id_especialidad,nombre,descripcion
1,Especialidad_1,Get sort level across become.
2,Especialidad_2,Character decision story author.
3,Especialidad_3,Herself fast plant simple product any.
4,Especialidad_4,Situation civil husband gas dog.
5,Especialidad_5,Represent ago it camera language set believe.
6,Especialidad_6,Say ability raise he box some baby.
7,Especialidad_7,Do significant movie accept challenge wonder gun.
8,Especialidad_8,Southern effort citizen very.
9,Especialidad_9,Yard many there for recognize human.
10,Especialidad_10,Themselves base billion side bank notice.
11,Especialidad_11,Both those degree across race sell wall.
12,Especialidad_12,Run think particular dark.
13,Especialidad_13,Member style support poor report PM improve.
14,Especialidad_14,Defense attack reflect result responsibility inside.
15,Especialidad_15,Control only risk their sell.
16,Especialidad_16,Necessary bar occur rather rate affect.
17,Especialidad_17,Recently according why point.
18,Especialidad_18,Environment seven practice dog.
19,Especialidad_19,Establish second since.
20,Especialidad_20,Size really month.
21,Especialidad_21,Politics pull her thousand part training like machine.
22,Especialidad_22,Why box practice.
23,Especialidad_23,Low not government effect late seat above finish.
24,Especialidad_24,Third often pressure argue hotel argue itself.
25,Especialidad_25,Party almost mission book.
26,Especialidad_26,Gun audience blood run that big shake.
27,Especialidad_27,Most ever improve better return.
28,Especialidad_28,None city military program next important on.
29,Especialidad_29,Return ago myself should wear lay.
30,Especialidad_30,Board figure pressure though.
31,Especialidad_31,Pay camera mention many network form training.
32,Especialidad_32,Past society phone administration hospital law.
33,Especialidad_33,Professional choose respond step card model go.
34,Especialidad_34,Store ok significant senior better country type agree.
35,Especialidad_35,Worry final agree heavy federal fund mother whom.
36,Especialidad_36,Indicate ask hope increase knowledge too.
37,Especialidad_37,Want beyond magazine friend.
38,Especialidad_38,Skill political really these dinner security.
39,Especialidad_39,Kitchen by rock imagine.
40,Especialidad_40,Machine despite head ahead serious take.
41,Especialidad_41,Party would far turn.
42,Especialidad_42,Nation somebody that program morning as.
43,Especialidad_43,Leader training statement build eye standard election.
44,Especialidad_44,Father human individual same let nothing never.
45,Especialidad_45,Same skill scene player.
46,Especialidad_46,Design military wall say happy.
47,Especialidad_47,Push kind water wall score.
48,Especialidad_48,Station all serve expect.
49,Especialidad_49,Guy nice strategy cost generation ground.
50,Especialidad_50,Food per must see much truth staff yeah.
51,Especialidad_51,Traditional read smile agree mission.
52,Especialidad_52,The spring realize speech its less again themselves.
53,Especialidad_53,Near traditional store hundred series.
54,Especialidad_54,Throw college certain field administration open add.
55,Especialidad_55,Brother to individual room.
56,Especialidad_56,Stop will drive series I detail.
57,Especialidad_57,Remember past whether list through feeling bag along.
58,Especialidad_58,Offer either easy toward Republican.
59,Especialidad_59,Ready father true truth long full.
60,Especialidad_60,Action share attack executive life.
61,Especialidad_61,Moment defense thousand model involve toward.
62,Especialidad_62,Style resource oil win.
63,Especialidad_63,Phone eat item style main stock hard.
64,Especialidad_64,Listen seven door factor product oil fact suddenly.
65,Especialidad_65,Green especially lot garden land form so sure.
66,Especialidad_66,Tell indicate according nothing.
67,Especialidad_67,American agency deal bit it particularly very.
68,Especialidad_68,Treat cold technology red tough fine.
69,Especialidad_69,How decide raise owner wall bank skin.
70,Especialidad_70,Or section month deal rather fine both.
71,Especialidad_71,Light according stay civil guy end site.
72,Especialidad_72,Beautiful agree together much evening television impact.
73,Especialidad_73,Activity consider assume see protect pattern our.
74,Especialidad_74,Minute baby I be source alone if stay.
75,Especialidad_75,One teach involve product just.
76,Especialidad_76,Rule term significant hotel.
77,Especialidad_77,Dog to financial he cause million.
78,Especialidad_78,Security professional hope.
79,Especialidad_79,Rate question prove property general unit.
80,Especialidad_80,Bit newspaper surface show rule seem spend.
81,Especialidad_81,Production listen main much grow page arrive spring.
82,Especialidad_82,Spring decide expect can become speak water.
83,Especialidad_83,Case everybody whatever computer democratic.
84,Especialidad_84,Purpose lot newspaper someone information before decade.
85,Especialidad_85,Produce she accept else language.
86,Especialidad_86,Decade foot right knowledge.
87,Especialidad_87,Government term program current really she avoid.
88,Especialidad_88,Now play some.
89,Especialidad_89,Process yourself never base unit.
90,Especialidad_90,Life gas send group goal agency.
91,Especialidad_91,Civil fine western suddenly analysis home not.
92,Especialidad_92,Forward major look.
93,Especialidad_93,Since television sit letter learn short.
94,Especialidad_94,Find second the discussion camera two.
95,Especialidad_95,Thank product whether accept.
96,Especialidad_96,Sit population performance attorney always.
97,Especialidad_97,Whole deep possible most.
98,Especialidad_98,Goal PM race kind.
99,Especialidad_99,Record will sit account collection defense similar then.
100,Especialidad_100,Stage way increase film coach.
101,Especialidad_101,Make to east stay total several different.
102,Especialidad_102,Break into political total party court.
103,Especialidad_103,Area join become record news walk professor.
104,Especialidad_104,Else generation serve shake according.
105,Especialidad_105,Capital man well company me least.
106,Especialidad_106,Music draw part your father within.
107,Especialidad_107,Rich investment girl single.
108,Especialidad_108,Note voice sister heavy top cost war.
109,Especialidad_109,Leg concern himself whom instead close life.
110,Especialidad_110,Follow light participant of with.
111,Especialidad_111,These increase quickly stuff clear.
112,Especialidad_112,Collection exactly she produce care serve nation.
113,Especialidad_113,Enjoy back avoid environment activity wall clearly candidate.
114,Especialidad_114,Edge someone base operation.
115,Especialidad_115,Move history brother sense pass.
116,Especialidad_116,Tax ok nation mother whom.
117,Especialidad_117,Teach institution central attorney unit tend seek.
118,Especialidad_118,Five surface understand value.
119,Especialidad_119,Contain democratic nation news natural.
120,Especialidad_120,Past clear wide.
121,Especialidad_121,Fish dark set among.
122,Especialidad_122,Your everyone hand military man marriage.
123,Especialidad_123,Yourself know less.
124,Especialidad_124,Everybody similar huge admit.
125,Especialidad_125,Analysis plan single account seven finish.
126,Especialidad_126,Hour staff once alone.
127,Especialidad_127,Maintain best situation major.
128,Especialidad_128,Now either individual prepare draw seek address.
129,Especialidad_129,Amount thought mind throw catch.
130,Especialidad_130,Huge show view but.
131,Especialidad_131,Record that card employee.
132,Especialidad_132,Mission above since throughout many.
133,Especialidad_133,Large account cold thank together.
134,Especialidad_134,Enjoy way rate ever early.
135,Especialidad_135,Small sing could value across process somebody computer.
136,Especialidad_136,Investment high PM bar dog can economy nor.
137,Especialidad_137,Sign continue success.
138,Especialidad_138,Attention Democrat discussion camera.
139,Especialidad_139,Gas lose week money teacher.
140,Especialidad_140,Take next yard seven most year.
141,Especialidad_141,Particularly whatever cost always while behind loss.
142,Especialidad_142,Strong member loss short better.
143,Especialidad_143,Again safe pay low rule hour language.
144,Especialidad_144,Enough hit number go.
145,Especialidad_145,These per professional manage about three against.
146,Especialidad_146,May either accept wall.
147,Especialidad_147,Six life best account institution government.
148,Especialidad_148,Idea when simple each.
149,Especialidad_149,Product open professional billion treat much.
150,Especialidad_150,Land or Congress what step newspaper.
151,Especialidad_151,War movement baby whose.
152,Especialidad_152,Particularly front national word several unit add.
153,Especialidad_153,Effect civil place tell.
154,Especialidad_154,Activity event million keep decade might commercial.
155,Especialidad_155,About fill director really oil could away particularly.
156,Especialidad_156,Center economic manage situation who guess father.
157,Especialidad_157,Century cultural report action inside doctor.
158,Especialidad_158,Back anyone investment grow.
159,Especialidad_159,Black data group up environment usually benefit.
160,Especialidad_160,Player he power pretty technology bank why.
161,Especialidad_161,Personal case part glass benefit.
162,Especialidad_162,Source music buy style memory game accept.
163,Especialidad_163,Give my keep policy dog.
164,Especialidad_164,Pick government everyone market.
165,Especialidad_165,National difficult wide low white science air.
166,Especialidad_166,Respond speech network view.
167,Especialidad_167,Attention that conference question decision.
168,Especialidad_168,College particularly himself.
169,Especialidad_169,Fight none her personal statement explain hear.
170,Especialidad_170,Mean hair resource need task theory many.
171,Especialidad_171,Especially Republican her TV.
172,Especialidad_172,Country Mrs phone book with.
173,Especialidad_173,Floor possible pull inside.
174,Especialidad_174,Minute bill not agreement.
175,Especialidad_175,Day life scene often.
176,Especialidad_176,Such involve yard research reason.
177,Especialidad_177,Nor me understand.
178,Especialidad_178,Air politics fight whom foot fast.
179,Especialidad_179,Forget movie accept fill.
180,Especialidad_180,Nothing green moment even find question possible.
181,Especialidad_181,Dinner early model many.
182,Especialidad_182,Everybody trial bad cultural.
183,Especialidad_183,Despite meeting nature should price anyone discussion off.
184,Especialidad_184,Nor fine create design.
185,Especialidad_185,Shoulder executive key station major reach share such.
186,Especialidad_186,Time old cup stay people modern picture.
187,Especialidad_187,Structure professor still billion.
188,Especialidad_188,Discuss through natural hold guy.
189,Especialidad_189,Song attack environment understand each.
190,Especialidad_190,Land test society democratic positive show produce.
191,Especialidad_191,Human small enter old institution executive physical.
192,Especialidad_192,Public series share officer.
193,Especialidad_193,Lawyer and never mouth.
194,Especialidad_194,Hospital day feeling religious modern hear glass.
195,Especialidad_195,Board for garden rather sense.
196,Especialidad_196,Around fear real different year teacher.
197,Especialidad_197,Whose mention use break ability head catch.
198,Especialidad_198,Relationship yeah send.
199,Especialidad_199,Father study man matter.
200,Especialidad_200,Mission low month there car no specific.
201,Especialidad_201,Main poor ability hit.
202,Especialidad_202,Follow participant me meet daughter Congress network.
203,Especialidad_203,Offer assume owner race.
204,Especialidad_204,Old just sport fact.
205,Especialidad_205,Customer movement responsibility yes lead agent.
206,Especialidad_206,Vote center worker high discuss reduce many pick.
207,Especialidad_207,Crime usually man.
208,Especialidad_208,Education it positive investment hour.
209,Especialidad_209,Sign father hotel campaign.
210,Especialidad_210,Position ever once same make hundred what onto.
211,Especialidad_211,Student since actually stand Mr third.
212,Especialidad_212,Simple up may three project.
213,Especialidad_213,Class century measure.
214,Especialidad_214,President professional purpose last trial support.
215,Especialidad_215,Attack understand charge hundred cover image.
216,Especialidad_216,Decide over part describe huge campaign.
217,Especialidad_217,Senior follow cell to place smile.
218,Especialidad_218,Sure brother huge budget.
219,Especialidad_219,Maybe remember message administration common get lawyer economic.
220,Especialidad_220,Occur case book environmental.
221,Especialidad_221,Could brother audience explain various.
222,Especialidad_222,Ever have up.
223,Especialidad_223,Until wonder big family next night international around.
224,Especialidad_224,Themselves specific like benefit tax certainly.
225,Especialidad_225,Summer change Mr clear change.
226,Especialidad_226,Something magazine decide Democrat fly.
227,Especialidad_227,Weight machine member fly guy try above.
228,Especialidad_228,None impact positive.
229,Especialidad_229,It past member let.
230,Especialidad_230,It major adult officer.
231,Especialidad_231,Three mind might point.
232,Especialidad_232,Country list decide camera.
233,Especialidad_233,Bag yeah view American meeting.
234,Especialidad_234,Reality rule dream newspaper drive wrong lay seat.
235,Especialidad_235,Card now young.
236,Especialidad_236,Expect receive television happy performance.
237,Especialidad_237,Main dog term already organization include able.
238,Especialidad_238,Less lot car participant democratic that pick.
239,Especialidad_239,System production matter themselves.
240,Especialidad_240,Power face happy cup.
241,Especialidad_241,Newspaper identify area receive role life.
242,Especialidad_242,End on but when behavior.
243,Especialidad_243,Until system article rest those outside.
244,Especialidad_244,Score realize task fish approach heavy.
245,Especialidad_245,Democratic candidate language line notice same.
246,Especialidad_246,People mean beyond land if field.
247,Especialidad_247,Race him bag better his.
248,Especialidad_248,Green newspaper phone table southern culture what.
249,Especialidad_249,Into music without reveal care example mother.
250,Especialidad_250,Ever bed value record structure yes answer.
251,Especialidad_251,Physical positive sister wish suddenly.
252,Especialidad_252,Read let star reality interview worry.
253,Especialidad_253,Such care describe in certain.
254,Especialidad_254,Be grow bag type day dream.
255,Especialidad_255,Dream key senior table why real not reach.
256,Especialidad_256,Great picture growth quite control.
257,Especialidad_257,Ever education garden piece wife.
258,Especialidad_258,Interview hard bed various region.
259,Especialidad_259,Among kid nature whole half never.
260,Especialidad_260,Spend for education sell.
261,Especialidad_261,Dinner head ever expect turn.
262,Especialidad_262,Affect beyond network per eat Mrs.
263,Especialidad_263,Take near purpose.
264,Especialidad_264,Avoid north use.
265,Especialidad_265,Maintain have view indicate discover.
266,Especialidad_266,Quality how discussion run series task.
267,Especialidad_267,Open sing key yard if work.
268,Especialidad_268,Agreement win list along language writer.
269,Especialidad_269,Alone order southern plan build able.
270,Especialidad_270,Various people senior property air any wear.
271,Especialidad_271,Read condition fine vote music wait.
272,Especialidad_272,Explain one director.
273,Especialidad_273,Data player no these affect key other.
274,Especialidad_274,Bed forget against fund magazine.
275,Especialidad_275,Large free simply focus poor build south hear.
276,Especialidad_276,Safe floor fall most kitchen pay civil.
277,Especialidad_277,Force successful approach feeling mouth.
278,Especialidad_278,Affect director whether.
279,Especialidad_279,Project after everyone her certainly parent.
280,Especialidad_280,Them pretty its management.
281,Especialidad_281,Allow attention yet.
282,Especialidad_282,Truth stop also imagine strategy.
283,Especialidad_283,Everyone economic value once.
284,Especialidad_284,She baby of worry present door option.
285,Especialidad_285,Today poor which born how upon opportunity.
286,Especialidad_286,Successful wife during me financial.
287,Especialidad_287,Either pay coach.
288,Especialidad_288,Memory media base weight quality check how perform.
289,Especialidad_289,Agent free recognize community significant city commercial.
290,Especialidad_290,Shoulder perhaps significant.
291,Especialidad_291,Already create step three.
292,Especialidad_292,Need leader sort wrong again exactly.
293,Especialidad_293,Player shoulder my consumer either government maintain point.
294,Especialidad_294,Hotel practice run inside.
295,Especialidad_295,Feel require main evening north somebody stop.
296,Especialidad_296,Impact read character develop player fish.
297,Especialidad_297,Air have admit player argue.
298,Especialidad_298,Lose money rule trip big.
299,Especialidad_299,Customer author class believe position.
300,Especialidad_300,Real enough reality.
301,Especialidad_301,Building size almost democratic social.
302,Especialidad_302,Against indeed suggest.
303,Especialidad_303,Issue wrong open stock nation.
304,Especialidad_304,Year magazine present beyond effect language.
305,Especialidad_305,Voice president wonder big painting.
306,Especialidad_306,Stock soon themselves movement name law food.
307,Especialidad_307,Subject play want word.
308,Especialidad_308,Detail study line lose.
309,Especialidad_309,Mission project involve finally new.
310,Especialidad_310,Anyone ever life none add north among.
311,Especialidad_311,Education song marriage wear structure.
312,Especialidad_312,Event live adult second usually.
313,Especialidad_313,True idea candidate argue provide decision most state.
314,Especialidad_314,Line raise trouble together.
315,Especialidad_315,Fact state clear Mrs reflect.
316,Especialidad_316,Receive small explain type phone commercial effort.
317,Especialidad_317,Board capital eat benefit song military culture.
318,Especialidad_318,Both look responsibility assume would have.
319,Especialidad_319,Claim good my easy population.
320,Especialidad_320,Process they single think human cup we.
321,Especialidad_321,Foreign mission step deal doctor PM economy.
322,Especialidad_322,Where gas ready have fill until.
323,Especialidad_323,Act company subject dream fish term style.
324,Especialidad_324,Ability see majority.
325,Especialidad_325,Five lose away.
326,Especialidad_326,Daughter hear trouble growth million spend rich.
327,Especialidad_327,Behind force rock maybe door letter word.
328,Especialidad_328,Business real over individual.
329,Especialidad_329,Cold member question finish oil decide physical.
330,Especialidad_330,Stand for over rock.
331,Especialidad_331,Every build international professional.
332,Especialidad_332,Certainly animal follow he project the human.
333,Especialidad_333,Including forget wait matter.
334,Especialidad_334,Work professional heart them develop.
335,Especialidad_335,Role purpose central view modern partner store.
336,Especialidad_336,National parent ask table condition.
337,Especialidad_337,Start national current environment skill.
338,Especialidad_338,Conference improve ahead wonder as process cover.
339,Especialidad_339,Whole back music run arrive tonight because who.
340,Especialidad_340,Quickly technology set both sure.
341,Especialidad_341,Hard city whatever right hour nothing sit.
342,Especialidad_342,Owner enter heart dream.
343,Especialidad_343,Build speak character partner blood use.
344,Especialidad_344,Billion financial design rest you.
345,Especialidad_345,Hard moment most movement enough civil four.
346,Especialidad_346,Choice station box Mr mother professional worker.
347,Especialidad_347,Prove company so part.
348,Especialidad_348,Dream push something political.
349,Especialidad_349,Hard when carry stuff trouble realize.
350,Especialidad_350,Later student until board.
351,Especialidad_351,Admit billion necessary stop manager long.
352,Especialidad_352,Husband person shake hard election standard local.
353,Especialidad_353,Admit become pick speech.
354,Especialidad_354,Audience control campaign school.
355,Especialidad_355,Result weight high billion.
356,Especialidad_356,Member vote against forget but why issue.
357,Especialidad_357,Pass whatever want central federal follow.
358,Especialidad_358,Lot into call positive.
359,Especialidad_359,Tv pass or successful president yeah partner.
360,Especialidad_360,Staff doctor employee wind professional fact.
361,Especialidad_361,Consumer now personal any.
362,Especialidad_362,Itself animal their could nature may eight tend.
363,Especialidad_363,Evidence nation myself memory fight gun.
364,Especialidad_364,Nature case minute continue discuss.
365,Especialidad_365,Miss game wait.
366,Especialidad_366,Ball guess above anything.
367,Especialidad_367,Western serious back war crime.
368,Especialidad_368,Billion well most thank small guess.
369,Especialidad_369,State reveal themselves before officer walk.
370,Especialidad_370,Billion push involve mission.
371,Especialidad_371,Tell remember business travel space already item.
372,Especialidad_372,Already artist lay whole.
373,Especialidad_373,Conference fear wrong mention hotel.
374,Especialidad_374,Nice walk different human there note her owner.
375,Especialidad_375,Everyone there majority cell pressure.
376,Especialidad_376,Hour box nature wrong production area experience.
377,Especialidad_377,Drop member mind alone dream manage.
378,Especialidad_378,Meeting rate course yet understand difference.
379,Especialidad_379,Really or degree leg while near.
380,Especialidad_380,Process feel almost society design hotel.
381,Especialidad_381,Term necessary statement name him doctor detail.
382,Especialidad_382,Bill lead suddenly just work identify.
383,Especialidad_383,Here concern should cost economic.
384,Especialidad_384,What those style admit similar full.
385,Especialidad_385,Modern follow collection standard.
386,Especialidad_386,Thing mind hundred which cold three lay center.
387,Especialidad_387,Him local receive job share keep.
388,Especialidad_388,Season growth simply protect rise ready how.
389,Especialidad_389,Sound certainly travel.
390,Especialidad_390,Three argue night him training soon.
391,Especialidad_391,Social probably thing popular.
392,Especialidad_392,Cup month radio ten nature great.
393,Especialidad_393,Subject rock rich.
394,Especialidad_394,Avoid two where provide chair forget.
395,Especialidad_395,Worker back at resource positive deep least.
396,Especialidad_396,Early now customer even century message forward.
397,Especialidad_397,Market security executive probably price price.
398,Especialidad_398,Enough sound southern son approach condition get necessary.
399,Especialidad_399,On good social player.
400,Especialidad_400,Young on red hour.
401,Especialidad_401,Whether state recognize.
402,Especialidad_402,Religious face they western.
403,Especialidad_403,Another his cover order.
404,Especialidad_404,Picture case not that.
405,Especialidad_405,Job agent language woman.
406,Especialidad_406,Run decision hard attorney model.
407,Especialidad_407,Amount break at make anything since.
408,Especialidad_408,Lay shake wear stay.
409,Especialidad_409,Value low middle tough around most.
410,Especialidad_410,Buy around morning establish.
411,Especialidad_411,Let nature or.
412,Especialidad_412,Few discuss worker evidence.
413,Especialidad_413,Gun actually recognize personal PM south.
414,Especialidad_414,Group today parent heart morning together simply say.
415,Especialidad_415,Structure least case budget room beautiful pull.
416,Especialidad_416,Somebody well now body man tough foot we.
417,Especialidad_417,Impact during issue ground girl.
418,Especialidad_418,Court go feel especially system hour.
419,Especialidad_419,Tend thank factor alone media treatment.
420,Especialidad_420,Shake laugh month left.
421,Especialidad_421,Us action easy right behind less.
422,Especialidad_422,Challenge sea investment market.
423,Especialidad_423,Improve concern piece between.
424,Especialidad_424,Cup condition probably their official sing continue debate.
425,Especialidad_425,Newspaper way experience deep.
426,Especialidad_426,Partner five partner generation stay compare meet.
427,Especialidad_427,Work store material eye unit degree democratic.
428,Especialidad_428,Local major dream.
429,Especialidad_429,Unit next lead perform.
430,Especialidad_430,Officer effort dog find here then.
431,Especialidad_431,Another range baby piece.
432,Especialidad_432,Interview family especially actually.
433,Especialidad_433,Fall room camera art natural art thousand.
434,Especialidad_434,Culture financial structure ahead picture magazine card prove.
435,Especialidad_435,Firm learn conference business child.
436,Especialidad_436,Hear citizen technology.
437,Especialidad_437,National before hotel create both treat.
438,Especialidad_438,Finally institution region successful.
439,Especialidad_439,Today site little.
440,Especialidad_440,Check future state lot lead.
441,Especialidad_441,Serve they care usually story grow agree like.
442,Especialidad_442,Card red prevent plant result.
443,Especialidad_443,Poor space grow what until.
444,Especialidad_444,Billion sport whom natural material few us.
445,Especialidad_445,Already lawyer talk side.
446,Especialidad_446,Theory six suddenly rule read military billion.
447,Especialidad_447,Brother soon from specific represent fire make.
448,Especialidad_448,Between future benefit floor place develop sure author.
449,Especialidad_449,Game well yet whose read be.
450,Especialidad_450,About similar method threat program professional.
451,Especialidad_451,Letter food high of.
