id_especialidad,nombre,descripcion
452,Especialidad_452,Charge middle stage follow right east.
453,Especialidad_453,Know so own mouth.
454,Especialidad_454,One stage our without identify.
455,Especialidad_455,Sort face during contain safe need reduce question.
456,Especialidad_456,Nearly street may service lay who little.
457,Especialidad_457,Employee now better six eat.
458,Especialidad_458,Door investment worry save American picture.
459,Especialidad_459,Force cost staff around movement technology.
460,Especialidad_460,Seven player six position forget total card.
461,Especialidad_461,After series week action.
462,Especialidad_462,Market others itself room short.
463,Especialidad_463,Particular quite clear half mean kitchen simply.
464,Especialidad_464,Sell entire for four determine.
465,Especialidad_465,Ago reach resource investment respond.
466,Especialidad_466,Idea firm very dark total including out.
467,Especialidad_467,Door yourself direction agency these author.
468,Especialidad_468,Left pattern party training visit rather through identify.
469,Especialidad_469,Network lay matter hope window them ready.
470,Especialidad_470,From score audience this long government technology.
471,Especialidad_471,Hotel stock early lay school very low.
472,Especialidad_472,Many evening that.
473,Especialidad_473,Project nearly true outside every hair.
474,Especialidad_474,Dark they bill if page.
475,Especialidad_475,Time onto effort bar whatever.
476,Especialidad_476,Around want group new above.
477,Especialidad_477,Behavior strategy face.
478,Especialidad_478,Administration decision goal message during husband.
479,Especialidad_479,Sport physical whole like employee this discussion.
480,Especialidad_480,Grow nor site building laugh wind.
481,Especialidad_481,Day care recently wonder shake center.
482,Especialidad_482,While sometimes listen use gun each who.
483,Especialidad_483,Reveal send man interesting money.
484,Especialidad_484,Phone six recently develop argue degree.
485,Especialidad_485,Writer strong hold hundred organization left.
486,Especialidad_486,Reflect institution dream country tend.
487,Especialidad_487,Notice social anything story establish only present.
488,Especialidad_488,Staff power finally stop step appear these.
489,Especialidad_489,Guy impact capital want rock.
490,Especialidad_490,Building top enter up kind.
491,Especialidad_491,Radio discuss box military.
492,Especialidad_492,Mother eat raise mother control.
493,Especialidad_493,North yeah scientist us result.
494,Especialidad_494,Factor speak teach.
495,Especialidad_495,Moment eye can forward top a.
496,Especialidad_496,Thousand population stand their keep how.
497,Especialidad_497,Size bed far fish fall use contain.
498,Especialidad_498,Large anyone according action area across.
499,Especialidad_499,Sense same attack avoid describe detail.
500,Especialidad_500,Together child international but can.
501,Especialidad_501,Any begin together suddenly.
502,Especialidad_502,On difference research several money.
503,Especialidad_503,Wish story miss form already wall return.
504,Especialidad_504,Western and strategy world.
505,Especialidad_505,Civil early hand baby worry could deal.
506,Especialidad_506,Group deal many range exist.
507,Especialidad_507,Over and field any single teacher across draw.
508,Especialidad_508,Night rate positive pretty account.
509,Especialidad_509,Suffer mention for worry.
510,Especialidad_510,Treat him material own likely.
511,Especialidad_511,Hard sort gas color.
512,Especialidad_512,Follow item job several song standard.
513,Especialidad_513,Total tax feel.
514,Especialidad_514,Cost subject contain generation election quickly.
515,Especialidad_515,Culture near industry company decision.
516,Especialidad_516,Term occur shoulder.
517,Especialidad_517,Base without woman type third police test ask.
518,Especialidad_518,Economy third believe provide the.
519,Especialidad_519,Attention could poor just.
520,Especialidad_520,Catch in air.
521,Especialidad_521,High smile give difference remember forget.
522,Especialidad_522,Usually listen may pull usually firm.
523,Especialidad_523,Police bad father indeed education.
524,Especialidad_524,Edge walk before section.
525,Especialidad_525,Establish long of have degree place.
526,Especialidad_526,Upon never difference themselves out.
527,Especialidad_527,Enter statement hot name responsibility.
528,Especialidad_528,Have return environmental seat.
529,Especialidad_529,Thus prevent walk involve like four light.
530,Especialidad_530,Voice role any consumer wife.
531,Especialidad_531,Bank perform know challenge.
532,Especialidad_532,Although little can trouble reason.
533,Especialidad_533,Far until east him.
534,Especialidad_534,Leave require week officer.
535,Especialidad_535,Machine billion owner beautiful suffer that produce carry.
536,Especialidad_536,Ready kid reason truth deep.
537,Especialidad_537,Turn per garden short wall after.
538,Especialidad_538,Organization middle side ground with.
539,Especialidad_539,Charge clear exactly source improve order attack.
540,Especialidad_540,After move hit both even.
541,Especialidad_541,Popular especially media.
542,Especialidad_542,Certainly mouth job community letter space.
543,Especialidad_543,Their show exactly despite open level professor.
544,Especialidad_544,Because wife back send note discover quite.
545,Especialidad_545,Assume body left through.
546,Especialidad_546,Down military have necessary.
547,Especialidad_547,North wrong read treatment help.
548,Especialidad_548,Year result option information wide relate.
549,Especialidad_549,Free crime interest those nearly doctor morning.
550,Especialidad_550,Value product ok which anyone else side.
551,Especialidad_551,Artist hotel risk under both decision girl much.
552,Especialidad_552,Dream mind partner produce.
553,Especialidad_553,Since outside media list.
554,Especialidad_554,Including million form democratic view say goal total.
555,Especialidad_555,Matter best stop little wide than sell.
556,Especialidad_556,Notice up article certainly any then.
557,Especialidad_557,Yet its tough set.
558,Especialidad_558,Threat analysis travel right maintain.
559,Especialidad_559,International goal research probably these our talk.
560,Especialidad_560,Look much us finish speech.
561,Especialidad_561,Upon sense girl quality manage.
562,Especialidad_562,Office record education few experience investment where.
563,Especialidad_563,Step someone mean ahead administration.
564,Especialidad_564,Serve attorney represent admit.
565,Especialidad_565,Respond watch different marriage expert.
566,Especialidad_566,Factor common upon admit three hundred.
567,Especialidad_567,Whole mention dream employee.
568,Especialidad_568,Social nature their explain poor heart call avoid.
569,Especialidad_569,Other worry rock before really away early.
570,Especialidad_570,Impact hospital trip their theory spring difference.
571,Especialidad_571,Wonder life magazine player indeed.
572,Especialidad_572,Reflect and maintain treat account able.
573,Especialidad_573,Church morning plan bit.
574,Especialidad_574,Inside campaign teach seek national data.
575,Especialidad_575,Class improve move our camera.
576,Especialidad_576,Item situation born option floor style word.
577,Especialidad_577,Language person think social.
578,Especialidad_578,Long picture get his example pay two nor.
579,Especialidad_579,Operation sign report modern now.
580,Especialidad_580,Enough moment across manager within art stop.
581,Especialidad_581,Part product technology trade decide recognize.
582,Especialidad_582,Small enjoy everyone less item staff.
583,Especialidad_583,Peace heavy company police loss from degree.
584,Especialidad_584,Way trial might system east do.
585,Especialidad_585,Peace important natural easy quickly sound.
586,Especialidad_586,Within stock treatment market student worker account.
587,Especialidad_587,Various must memory environment film day world unit.
588,Especialidad_588,Tonight stage how moment meeting his enough.
589,Especialidad_589,Tree politics accept structure center enter.
590,Especialidad_590,Base many month decision ever environmental sign.
591,Especialidad_591,Fall improve board fall activity.
592,Especialidad_592,Food since result coach more apply religious.
593,Especialidad_593,Ready report involve four occur simply significant.
594,Especialidad_594,Various network represent kitchen modern also home conference.
595,Especialidad_595,Art beautiful now heavy size.
596,Especialidad_596,Structure laugh number tree.
597,Especialidad_597,Very yard determine feel.
598,Especialidad_598,Need black majority this model according.
599,Especialidad_599,Computer institution year rest young.
600,Especialidad_600,Stop west both box.
601,Especialidad_601,Art black bring grow.
602,Especialidad_602,Family everything movie.
603,Especialidad_603,Sort will ago hit window read prepare.
604,Especialidad_604,Serve next factor against official huge industry.
605,Especialidad_605,Rather listen region site event your.
606,Especialidad_606,Assume ask answer its whether.
607,Especialidad_607,Fact agent allow government current financial just.
608,Especialidad_608,Look simple carry him.
609,Especialidad_609,Crime wish husband write believe music activity traditional.
610,Especialidad_610,Nearly actually hit.
611,Especialidad_611,Word call security worker.
612,Especialidad_612,Degree agreement development five every.
613,Especialidad_613,Collection political again according.
614,Especialidad_614,Bag well per authority.
615,Especialidad_615,Dinner book save notice law themselves.
616,Especialidad_616,Order close American life music point material.
617,Especialidad_617,Commercial collection well organization.
618,Especialidad_618,Theory follow rest food.
619,Especialidad_619,Phone tax better newspaper arrive sound get main.
620,Especialidad_620,Partner book series once might simple impact.
621,Especialidad_621,That form large hotel within.
622,Especialidad_622,Consumer specific they magazine purpose.
623,Especialidad_623,Whose alone listen several kind.
624,Especialidad_624,Road then study most future question value.
625,Especialidad_625,Always wall tax every never inside.
626,Especialidad_626,Result right never about.
627,Especialidad_627,Scientist boy cold interesting.
628,Especialidad_628,Sport up security report.
629,Especialidad_629,Food fire region than care nor.
630,Especialidad_630,Scientist current spring measure true.
631,Especialidad_631,If society newspaper page western remember.
632,Especialidad_632,Sit all degree only cost response old.
633,Especialidad_633,Even name energy.
634,Especialidad_634,Bit certainly knowledge.
635,Especialidad_635,Wife section sound to billion wear let.
636,Especialidad_636,Media capital check camera follow can heavy example.
637,Especialidad_637,Question medical candidate.
638,Especialidad_638,That three value.
639,Especialidad_639,Possible race general cut first hear explain.
640,Especialidad_640,Song fine beautiful half including card.
641,Especialidad_641,Road identify nearly center.
642,Especialidad_642,Cup raise particular read need sign.
643,Especialidad_643,Pressure worry strategy Mr.
644,Especialidad_644,Business must gas step significant.
645,Especialidad_645,Drive top difficult.
646,Especialidad_646,Around reality visit tax tough.
647,Especialidad_647,Son recent argue land.
648,Especialidad_648,Born agree similar area west.
649,Especialidad_649,Office cold cell against hot purpose.
650,Especialidad_650,Fish outside paper arm particular suffer reality.
651,Especialidad_651,Soon anything expect why fine.
652,Especialidad_652,Record mouth mission indeed.
653,Especialidad_653,Maintain close affect fund try yard.
654,Especialidad_654,Age yourself role.
655,Especialidad_655,Others speak partner political history TV southern.
656,Especialidad_656,Measure face visit which fear certain.
657,Especialidad_657,Kitchen now office pick.
658,Especialidad_658,Find sort minute level right goal.
659,Especialidad_659,Somebody but generation heart else recent.
660,Especialidad_660,Already important but all term phone.
661,Especialidad_661,Design college speak light.
662,Especialidad_662,Under same three behavior late.
663,Especialidad_663,Walk his his consumer.
664,Especialidad_664,Task enough standard black fact prevent.
665,Especialidad_665,Still around focus fine daughter.
666,Especialidad_666,Citizen south least should own.
667,Especialidad_667,Sure finally red trial behavior baby choose.
668,Especialidad_668,Race without argue political.
669,Especialidad_669,Share science near tough.
670,Especialidad_670,Party win truth.
671,Especialidad_671,While say claim experience suggest this wife.
672,Especialidad_672,Pick your play new every letter right.
673,Especialidad_673,Him field little tend politics themselves pick build.
674,Especialidad_674,Realize sense be purpose own cell where.
675,Especialidad_675,Whole involve hit why poor art event.
676,Especialidad_676,Rather child hundred owner production perform employee share.
677,Especialidad_677,Skill provide beautiful see option top.
678,Especialidad_678,Professor town same success affect modern draw.
679,Especialidad_679,Allow too set modern return when those however.
680,Especialidad_680,Memory its appear chair serve daughter recognize throw.
681,Especialidad_681,Spring into hope particular quite.
682,Especialidad_682,Source school produce put wall piece other.
683,Especialidad_683,Especially free step seem particularly himself black above.
684,Especialidad_684,Force owner author.
685,Especialidad_685,Him water yeah box process.
686,Especialidad_686,Begin establish character play available reality brother.
687,Especialidad_687,Product quality tree moment surface long voice.
688,Especialidad_688,Home source assume full read drop job student.
689,Especialidad_689,Us read world party hold would success.
690,Especialidad_690,Herself property executive major picture however character.
691,Especialidad_691,Tax after season treat own.
692,Especialidad_692,Cup must wear machine politics future.
693,Especialidad_693,This official election two more foot.
694,Especialidad_694,Explain reveal throw hear.
695,Especialidad_695,Hot often want ahead.
696,Especialidad_696,Commercial white tonight media walk.
697,Especialidad_697,Apply lead stay give dog dark simply rather.
698,Especialidad_698,Use radio leader western rock level foot now.
699,Especialidad_699,If position tonight all follow.
700,Especialidad_700,Huge reach data unit development human.
701,Especialidad_701,Book oil dog huge will goal four.
702,Especialidad_702,Rich mean adult tree offer.
703,Especialidad_703,Movie ever member support star group.
704,Especialidad_704,Garden central but.
705,Especialidad_705,Network floor happy character.
706,Especialidad_706,Player care company floor check blue force.
707,Especialidad_707,Performance social choose.
708,Especialidad_708,Generation short in window.
709,Especialidad_709,Tough doctor about anyone teacher knowledge western.
710,Especialidad_710,Whether hundred experience.
711,Especialidad_711,Expect sort remain happen.
712,Especialidad_712,Process past plant three another knowledge.
713,Especialidad_713,Interesting prevent doctor street get I travel believe.
714,Especialidad_714,Fill real job by instead race.
715,Especialidad_715,Successful try movement base live lawyer paper.
716,Especialidad_716,Ask light fast worker.
717,Especialidad_717,Sport assume strategy imagine.
718,Especialidad_718,But ahead expert long toward.
719,Especialidad_719,Difficult perhaps customer tough.
720,Especialidad_720,True marriage often letter.
721,Especialidad_721,Move east house today easy series woman.
722,Especialidad_722,Future thank ask explain scene base media.
723,Especialidad_723,Prove poor drive boy since.
724,Especialidad_724,Ok dinner specific four capital interview at arrive.
725,Especialidad_725,Return value action dark health remain.
726,Especialidad_726,Force at glass thought forget customer.
727,Especialidad_727,None value reason new either choose industry.
728,Especialidad_728,Agent account him spend.
729,Especialidad_729,Court magazine wind.
730,Especialidad_730,Man reveal large look which.
731,Especialidad_731,Still sound part blue.
732,Especialidad_732,Walk night letter large leg think budget identify.
733,Especialidad_733,Item a which almost budget.
734,Especialidad_734,From future market bed follow may thank.
735,Especialidad_735,Live wide remain decade wife although event.
736,Especialidad_736,Professional pressure describe.
737,Especialidad_737,Black leave rule enjoy.
738,Especialidad_738,Small know road middle.
739,Especialidad_739,Do some off owner really.
740,Especialidad_740,Friend start water.
741,Especialidad_741,Audience nor fly stay break toward.
742,Especialidad_742,Once on central right general.
743,Especialidad_743,Often speech bad develop.
744,Especialidad_744,Inside light point town doctor state.
745,Especialidad_745,Partner peace sense water center economy nice cut.
746,Especialidad_746,Improve bag possible southern rule.
747,Especialidad_747,Baby modern program executive recently follow put.
748,Especialidad_748,Book eight stand key recently hear.
749,Especialidad_749,He class couple hot activity.
750,Especialidad_750,Answer buy middle vote other.
751,Especialidad_751,Deep recent he expect sense.
752,Especialidad_752,List add hour size analysis top reveal.
753,Especialidad_753,Team newspaper long activity.
754,Especialidad_754,Weight lay far.
755,Especialidad_755,Describe eye own their standard Congress cup talk.
756,Especialidad_756,Later somebody onto evening ahead quickly collection drug.
757,Especialidad_757,Prevent already at reality national green.
758,Especialidad_758,Top road rate ten drop while range.
759,Especialidad_759,Civil paper this heavy lead.
760,Especialidad_760,Bit phone red add not.
761,Especialidad_761,In measure seek.
762,Especialidad_762,Every ok campaign activity possible full feel state.
763,Especialidad_763,Common memory late decade letter.
764,Especialidad_764,Impact able ever anything together.
765,Especialidad_765,Good loss everything perform.
766,Especialidad_766,Although have wall.
767,Especialidad_767,Eye long show yourself night though politics.
768,Especialidad_768,Value artist candidate build.
769,Especialidad_769,Agree action itself.
770,Especialidad_770,Military hair option matter public nor everybody.
771,Especialidad_771,Cover civil mean we cost student.
772,Especialidad_772,House consumer thought treatment address industry.
773,Especialidad_773,Level action agreement watch piece every.
774,Especialidad_774,Smile this apply side authority since trip.
775,Especialidad_775,Table mean require once task.
776,Especialidad_776,Price must decide man travel color.
777,Especialidad_777,Last specific full to miss structure determine.
778,Especialidad_778,Discuss argue woman.
779,Especialidad_779,Strong guess cost between body music cold.
780,Especialidad_780,Seat ground report woman kitchen public let.
781,Especialidad_781,Save write child others society.
782,Especialidad_782,Ball forget begin future never commercial.
783,Especialidad_783,Help while quite reach attention cold back care.
784,Especialidad_784,Economy value color however audience her require.
785,Especialidad_785,Summer special I add.
786,Especialidad_786,Relationship whose girl capital ten.
787,Especialidad_787,List item can cell.
788,Especialidad_788,Throw choice water design might change.
789,Especialidad_789,Two statement activity speak impact.
790,Especialidad_790,Remain attack risk anything determine do.
791,Especialidad_791,Message after play look dream keep.
792,Especialidad_792,More social be arrive among.
793,Especialidad_793,Mind coach stuff cell food middle.
794,Especialidad_794,Hit as think movement soon.
795,Especialidad_795,Race hotel condition first our court.
796,Especialidad_796,End out cell matter fact.
797,Especialidad_797,Central at stop help bad.
798,Especialidad_798,Rich edge already both student.
799,Especialidad_799,Economic item firm throw special lot.
800,Especialidad_800,Seem build alone beat.
801,Especialidad_801,Standard director property station develop.
802,Especialidad_802,Group clearly become what ask.
803,Especialidad_803,Interview around from fact sure TV about.
804,Especialidad_804,From appear phone charge say more see.
805,Especialidad_805,Skill add prevent.
806,Especialidad_806,Recently herself open can Democrat strong behavior.
807,Especialidad_807,Plan window mother.
808,Especialidad_808,Will class condition six.
809,Especialidad_809,Week political result imagine court.
810,Especialidad_810,Force whom break morning gun time high.
811,Especialidad_811,Three factor speak budget.
812,Especialidad_812,Decision before just production today expect.
813,Especialidad_813,Chance staff reveal continue somebody suddenly.
814,Especialidad_814,Court air scene heart training close science easy.
815,Especialidad_815,Site physical doctor reveal.
816,Especialidad_816,Threat lay understand most show family beautiful group.
817,Especialidad_817,Value arm hear really.
818,Especialidad_818,Police newspaper everybody father thus rich minute.
819,Especialidad_819,Upon nothing collection food continue.
820,Especialidad_820,Data ask here Congress west court.
821,Especialidad_821,Lead build white tend.
822,Especialidad_822,Whether ask know process water.
823,Especialidad_823,Method rate floor generation mean.
824,Especialidad_824,Despite to time call skin situation.
825,Especialidad_825,Little exactly he customer career couple.
826,Especialidad_826,Possible local out piece draw.
827,Especialidad_827,Want her fight a improve mission.
828,Especialidad_828,Education last yourself home.
829,Especialidad_829,Itself pattern our avoid down meeting magazine.
830,Especialidad_830,Throw manager strategy.
831,Especialidad_831,City something serious.
832,Especialidad_832,Whose threat early would would.
833,Especialidad_833,Prove how few method store enough wide hit.
834,Especialidad_834,Model better everything war many choice.
835,Especialidad_835,Water view fast wind stock.
836,Especialidad_836,Direction school green factor rather.
837,Especialidad_837,Tough truth me.
838,Especialidad_838,Art court check left character continue our.
839,Especialidad_839,Although out throw music.
840,Especialidad_840,Section vote sit arrive pressure can little plan.
841,Especialidad_841,International challenge for should write reason.
842,Especialidad_842,Large democratic especially race late better begin.
843,Especialidad_843,Teach form yes market.
844,Especialidad_844,There let throw technology live.
845,Especialidad_845,Board candidate deal her.
846,Especialidad_846,Hair glass seat rate trial drop.
847,Especialidad_847,Everybody while agent need reveal detail grow.
848,Especialidad_848,Though sure administration else require lawyer.
849,Especialidad_849,Sense suffer size one answer number.
850,Especialidad_850,Number force culture sense kind talk seven thank.
851,Especialidad_851,Bar radio us sound a.
852,Especialidad_852,Camera history war example.
853,Especialidad_853,Day word production itself cell land account president.
854,Especialidad_854,Open make add his.
855,Especialidad_855,Act million office discussion all big player.
856,Especialidad_856,Consumer turn experience.
857,Especialidad_857,Care out attorney arrive tough.
858,Especialidad_858,Development together agency today raise probably.
859,Especialidad_859,Space almost civil dog view.
860,Especialidad_860,Position heavy thank born sport game nor bad.
861,Especialidad_861,Media hold director tonight white power right.
862,Especialidad_862,Security voice force man left.
863,Especialidad_863,Become brother specific respond official best.
864,Especialidad_864,Exactly total outside score.
865,Especialidad_865,Necessary outside main democratic.
866,Especialidad_866,Turn prepare old condition run medical even.
867,Especialidad_867,Place until significant number look.
868,Especialidad_868,Religious have with country.
869,Especialidad_869,Maintain recognize south product through take.
870,Especialidad_870,During parent final article so yourself try.
871,Especialidad_871,Onto create physical upon sister break.
872,Especialidad_872,Set born hour important push.
873,Especialidad_873,Like bill break result take garden.
874,Especialidad_874,Year do degree money doctor.
875,Especialidad_875,Second improve person difficult.
876,Especialidad_876,Owner employee radio personal participant.
877,Especialidad_877,Sit society wonder pick begin visit bill boy.
878,Especialidad_878,Edge road perhaps already west college eight expert.
879,Especialidad_879,Business language than could ago.
880,Especialidad_880,Name age entire attack more high.
881,Especialidad_881,Group ball try debate.
882,Especialidad_882,Strategy join standard figure.
883,Especialidad_883,Politics within Democrat training.
884,Especialidad_884,Practice threat father woman stock.
885,Especialidad_885,Large lead finish be message myself summer.
886,Especialidad_886,Million happen very call American north official stuff.
887,Especialidad_887,Shoulder western recent order.
888,Especialidad_888,Wish be adult stuff whatever.
889,Especialidad_889,Call significant responsibility buy.
890,Especialidad_890,Sit thousand continue operation do draw operation represent.
891,Especialidad_891,Health between at door stop according heavy performance.
892,Especialidad_892,Past opportunity role above.
893,Especialidad_893,One father responsibility manager throughout.
894,Especialidad_894,Pm reality serve.
895,Especialidad_895,We although young turn build within.
896,Especialidad_896,Seem phone agreement.
897,Especialidad_897,Technology fine might through doctor attorney.
898,Especialidad_898,Realize statement history yard management anything ready.
899,Especialidad_899,Available station card information draw news.
900,Especialidad_900,Wonder he help issue over.
