id_especialidad,nombre,descripcion
901,Especialidad_901,Along director state crime.
902,Especialidad_902,Discover business himself either around order sign today.
903,Especialidad_903,Dream myself minute shoulder contain.
904,Especialidad_904,Around box entire charge medical.
905,Especialidad_905,Speak as interesting task third upon.
906,Especialidad_906,Plant put of why focus writer.
907,Especialidad_907,Us particular be process center.
908,Especialidad_908,Job last hope health city run.
909,Especialidad_909,Realize media college ago evidence system front.
910,Especialidad_910,Light goal production shake begin.
911,Especialidad_911,World tough free student skin individual woman teacher.
912,Especialidad_912,Anything whole necessary common.
913,Especialidad_913,Generation beautiful tax raise party become scientist.
914,Especialidad_914,Music without difficult reflect hospital.
915,Especialidad_915,Describe take natural serious no.
916,Especialidad_916,Shake address meeting within management identify.
917,Especialidad_917,View certainly beyond early.
918,Especialidad_918,Sea seem so.
919,Especialidad_919,Room history girl marriage.
920,Especialidad_920,Its social cut sing fly politics concern.
921,Especialidad_921,Trial meeting they hot near there least.
922,Especialidad_922,Political age participant others our travel idea.
923,Especialidad_923,Time adult now size down purpose cultural.
924,Especialidad_924,Friend hand look safe.
925,Especialidad_925,Some against night use off.
926,Especialidad_926,Black same structure new.
927,Especialidad_927,Across measure travel full arrive no.
928,Especialidad_928,Agree discover traditional notice hour herself collection want.
929,Especialidad_929,Glass community environmental suffer since article.
930,Especialidad_930,Raise woman low including have successful apply nearly.
931,Especialidad_931,Exist environment ground beautiful left.
932,Especialidad_932,Nothing rule light room.
933,Especialidad_933,Front choose create health blood.
934,Especialidad_934,Without my accept heavy economic point method.
935,Especialidad_935,Contain art middle.
936,Especialidad_936,Chance until type somebody.
937,Especialidad_937,Light away manage book wrong.
938,Especialidad_938,List leader carry middle.
939,Especialidad_939,Beautiful health less half both knowledge.
940,Especialidad_940,Theory spend heart no story work.
941,Especialidad_941,Identify whether animal low maybe evening defense.
942,Especialidad_942,Necessary work relate because service key.
943,Especialidad_943,Professional century form movement media end threat drop.
944,Especialidad_944,Tonight safe carry paper control effort.
945,Especialidad_945,Door middle really every state.
946,Especialidad_946,Surface western nor page economic it area.
947,Especialidad_947,Case identify knowledge inside not history activity.
948,Especialidad_948,Five very feel than generation down.
949,Especialidad_949,Their toward impact month such.
950,Especialidad_950,Seven home positive end pattern state power.
951,Especialidad_951,Whatever purpose politics health.
952,Especialidad_952,Away fund discover.
953,Especialidad_953,Movement even drop peace create my to southern.
954,Especialidad_954,Century window whether enough.
955,Especialidad_955,Line call choose available window vote.
956,Especialidad_956,Long officer fast trial.
957,Especialidad_957,Follow tree than sign region form.
958,Especialidad_958,Understand administration key.
959,Especialidad_959,Senior baby quite.
960,Especialidad_960,Imagine leader brother economic.
961,Especialidad_961,Recent about program son add here.
962,Especialidad_962,Ago carry short wall call investment.
963,Especialidad_963,Drug door local purpose difficult.
964,Especialidad_964,Team table rise media blood they must.
965,Especialidad_965,Little production build stock still.
966,Especialidad_966,Group focus forward property chance.
967,Especialidad_967,Paper high medical product.
968,Especialidad_968,Sense guess somebody total.
969,Especialidad_969,Field speak until participant.
970,Especialidad_970,Better simple what appear imagine local.
971,Especialidad_971,Capital situation young forget.
972,Especialidad_972,Receive drive best box.
973,Especialidad_973,Community middle threat reduce assume concern.
974,Especialidad_974,Last somebody generation pretty area young able.
975,Especialidad_975,Certain money risk daughter bill final fire seven.
976,Especialidad_976,Up include go leave.
977,Especialidad_977,When education particularly western pattern theory available.
978,Especialidad_978,Raise Mrs north common thing lead leader indeed.
979,Especialidad_979,Many themselves read part money listen speak.
980,Especialidad_980,Radio popular seven conference my wrong close.
981,Especialidad_981,Arm organization drive doctor behind several everyone.
982,Especialidad_982,Specific hospital avoid according full couple lay tend.
983,Especialidad_983,Stuff along perform.
984,Especialidad_984,Full instead gas deal cover do.
985,Especialidad_985,She measure that matter life treat strong.
986,Especialidad_986,Direction class figure key happy central.
987,Especialidad_987,Believe enough they something structure each figure feel.
988,Especialidad_988,Free artist meeting evening try.
989,Especialidad_989,True door behind you.
990,Especialidad_990,Man up radio many leave build case.
991,Especialidad_991,Wrong despite glass too technology.
992,Especialidad_992,Class appear the remember seven responsibility most create.
993,Especialidad_993,Part partner full.
994,Especialidad_994,Since who positive practice PM focus mother travel.
995,Especialidad_995,Let no garden girl without.
996,Especialidad_996,Nothing reality live decade.
997,Especialidad_997,Meet main ten religious someone yourself.
998,Especialidad_998,Bar listen anything table training area.
999,Especialidad_999,Senior of five American imagine.
1000,Especialidad_1000,Worry account including concern professor writer wind.
