id_especialidad,nombre,descripcion
5241,Especialidad_5241,Arm face form effect eye choose generation.
5242,Especialidad_5242,Position ability Democrat necessary indicate after.
5243,Especialidad_5243,Argue system father future.
5244,Especialidad_5244,Sort those business available indeed if.
5245,Especialidad_5245,Ago his dog local however get.
5246,Especialidad_5246,Make miss their decade fund deal.
5247,Especialidad_5247,Cause later put performance center by agent.
5248,Especialidad_5248,Music soldier reflect thousand.
5249,Especialidad_5249,For off any brother.
5250,Especialidad_5250,Often leg use often evening else.
5251,Especialidad_5251,Play pretty and.
5252,Especialidad_5252,Report property often life east week both.
5253,Especialidad_5253,Respond indeed several they understand.
5254,Especialidad_5254,Quite already compare born machine education.
5255,Especialidad_5255,Kitchen partner tell carry you finish.
5256,Especialidad_5256,Agree me economic end.
5257,Especialidad_5257,Paper baby parent check identify single.
5258,Especialidad_5258,Notice teacher responsibility visit how.
5259,Especialidad_5259,Federal no but another event camera least behind.
5260,Especialidad_5260,Thus simply including current thought film.
5261,Especialidad_5261,Real consider respond summer area.
5262,Especialidad_5262,Machine water her put author.
5263,Especialidad_5263,Down least during particularly cold.
5264,Especialidad_5264,Local yet face economy maybe force carry.
5265,Especialidad_5265,Can difference thing American any box west.
5266,Especialidad_5266,Attack song draw identify situation member.
5267,Especialidad_5267,Room market until range.
5268,Especialidad_5268,Admit information third TV level box too.
5269,Especialidad_5269,Ever manager policy task recently fine ground near.
5270,Especialidad_5270,Couple another near build.
5271,Especialidad_5271,East time become cell dog.
5272,Especialidad_5272,Rather without model data campaign understand nothing.
5273,Especialidad_5273,Anything many dark loss class forget while.
5274,Especialidad_5274,Night report wide nor.
5275,Especialidad_5275,Position often public if.
5276,Especialidad_5276,Local something provide.
5277,Especialidad_5277,Commercial gas visit open vote sign draw.
5278,Especialidad_5278,Produce mother lot federal argue specific card.
5279,Especialidad_5279,Represent guy stuff argue defense else wall.
5280,Especialidad_5280,Office one draw.
5281,Especialidad_5281,Sister education the front little action dinner.
5282,Especialidad_5282,Election include national data.
5283,Especialidad_5283,Tough manager let everyone bill house.
5284,Especialidad_5284,Defense shake care save.
5285,Especialidad_5285,Generation with however plan machine decade.
5286,Especialidad_5286,Again station modern blood increase item prevent.
5287,Especialidad_5287,Account get factor describe.
5288,Especialidad_5288,Politics relate price accept city couple these.
5289,Especialidad_5289,Me question western air would.
5290,Especialidad_5290,Fact close poor fact street.
5291,Especialidad_5291,Thank social perhaps yourself civil expert thus reach.
5292,Especialidad_5292,There big detail.
5293,Especialidad_5293,Mother give fact human.
5294,Especialidad_5294,Enter attack boy service.
5295,Especialidad_5295,Sense future edge vote away compare.
5296,Especialidad_5296,Training customer magazine skill truth affect.
5297,Especialidad_5297,Recognize some course analysis clearly sometimes plant anything.
5298,Especialidad_5298,Others prepare world with.
5299,Especialidad_5299,Before evening offer weight peace manage.
5300,Especialidad_5300,Each traditional family family reflect itself.
5301,Especialidad_5301,Camera similar near analysis area interest cut.
5302,Especialidad_5302,Just see sit knowledge near rest.
5303,Especialidad_5303,Woman case modern traditional artist.
5304,Especialidad_5304,Plan government whether argue become white produce.
5305,Especialidad_5305,A computer find look performance personal rather.
5306,Especialidad_5306,Much security sell low Democrat page drive officer.
5307,Especialidad_5307,None PM material though herself.
5308,Especialidad_5308,Late out food.
5309,Especialidad_5309,City analysis around within possible young view report.
5310,Especialidad_5310,Administration think no him.
5311,Especialidad_5311,True claim miss artist leg exist century.
5312,Especialidad_5312,Hear build instead collection allow you source imagine.
5313,Especialidad_5313,Occur environment message this.
5314,Especialidad_5314,Office use stop mouth.
5315,Especialidad_5315,Case include attack without risk brother.
5316,Especialidad_5316,Treat treat contain international development.
5317,Especialidad_5317,Pressure since necessary hot development issue air.
5318,Especialidad_5318,Ball itself claim election raise product Republican.
5319,Especialidad_5319,Debate paper field want.
5320,Especialidad_5320,Stage behavior natural picture hot concern.
5321,Especialidad_5321,Character however require name house.
5322,Especialidad_5322,Doctor outside customer open event.
5323,Especialidad_5323,Point call this south prevent they foreign.
5324,Especialidad_5324,Value discuss born push hotel matter.
5325,Especialidad_5325,Arm short president see social history sure green.
5326,Especialidad_5326,Example article fill throw my response product.
5327,Especialidad_5327,Nearly condition fire painting girl.
5328,Especialidad_5328,Exist begin movie under.
5329,Especialidad_5329,Voice student hair gas huge bed most.
5330,Especialidad_5330,Executive speech determine result that tax team area.
5331,Especialidad_5331,Economic sport son form.
5332,Especialidad_5332,Control finally off knowledge see doctor.
5333,Especialidad_5333,Reach candidate game position describe.
5334,Especialidad_5334,Identify simple say go event according town make.
5335,Especialidad_5335,Per guy college social.
5336,Especialidad_5336,Behavior back debate still brother laugh.
5337,Especialidad_5337,Important eight improve expert member today.
5338,Especialidad_5338,Better vote watch near.
5339,Especialidad_5339,Star dream give finish.
5340,Especialidad_5340,Often similar add entire hospital.
5341,Especialidad_5341,Nor how push computer require interesting.
5342,Especialidad_5342,Any order system until something peace recent.
5343,Especialidad_5343,Against PM send wait production know prove join.
5344,Especialidad_5344,Color from beat scene administration.
5345,Especialidad_5345,Us line difference.
5346,Especialidad_5346,Whether total need personal when.
5347,Especialidad_5347,Again cup enjoy turn rock range.
5348,Especialidad_5348,Protect material station marriage garden ago big.
5349,Especialidad_5349,Amount figure product fast.
5350,Especialidad_5350,Capital end carry scene feeling catch.
5351,Especialidad_5351,Draw what senior I.
5352,Especialidad_5352,Responsibility life improve daughter eight most possible experience.
5353,Especialidad_5353,Able owner raise.
5354,Especialidad_5354,Television technology of land husband lawyer mission maintain.
5355,Especialidad_5355,Politics easy same appear.
5356,Especialidad_5356,Factor chair model seat girl moment performance.
5357,Especialidad_5357,Clear animal general plan blue.
5358,Especialidad_5358,Clearly pay drop international be plant wide truth.
5359,Especialidad_5359,Assume do decision step itself lay true.
5360,Especialidad_5360,Late of image magazine ground.
5361,Especialidad_5361,Computer generation method great physical movie.
5362,Especialidad_5362,Sort play toward majority billion fill adult.
5363,Especialidad_5363,Send point soon prove catch.
5364,Especialidad_5364,Miss south fall water imagine standard call.
5365,Especialidad_5365,Ever occur success environment everyone hear event.
5366,Especialidad_5366,Every option measure.
5367,Especialidad_5367,Result bill total product international.
5368,Especialidad_5368,Girl nothing heavy.
5369,Especialidad_5369,Century gas live.
5370,Especialidad_5370,Threat woman policy.
5371,Especialidad_5371,Positive wind nearly type system.
5372,Especialidad_5372,Why of two.
5373,Especialidad_5373,Born treatment cut chance ready body style.
5374,Especialidad_5374,Local money cultural.
5375,Especialidad_5375,Own military yeah ok.
5376,Especialidad_5376,Indicate hit beat a lawyer assume cover human.
5377,Especialidad_5377,Lot both development must official.
5378,Especialidad_5378,Drop good foreign money baby create.
5379,Especialidad_5379,Thought employee wall general.
5380,Especialidad_5380,Bring current individual simply.
5381,Especialidad_5381,Score his president record movement.
5382,Especialidad_5382,Debate sing should concern effort.
5383,Especialidad_5383,Little table that image blue building.
5384,Especialidad_5384,Traditional president war drug want any together.
5385,Especialidad_5385,Song hope condition total reason degree.
5386,Especialidad_5386,Central everyone generation.
5387,Especialidad_5387,Surface new store whom sing set.
5388,Especialidad_5388,Woman project day involve.
5389,Especialidad_5389,Turn nothing wish measure free become any.
5390,Especialidad_5390,Soon election nothing tough what drop.
5391,Especialidad_5391,Another once during grow really contain.
5392,Especialidad_5392,Note guess think pressure investment.
5393,Especialidad_5393,Light future pretty respond.
5394,Especialidad_5394,Difference course employee send catch dream.
5395,Especialidad_5395,Hair team realize.
5396,Especialidad_5396,Interesting partner whole often.
5397,Especialidad_5397,Media number rule matter ground.
5398,Especialidad_5398,Explain sure report western ago will.
5399,Especialidad_5399,General almost great door less.
5400,Especialidad_5400,Only piece mean game car sometimes.
5401,Especialidad_5401,Themselves Mr beat avoid this reduce white.
5402,Especialidad_5402,Morning feel near kitchen dream.
5403,Especialidad_5403,Go little sing business save fall.
5404,Especialidad_5404,Attorney hundred exist benefit your.
5405,Especialidad_5405,Worker majority PM president another sort price.
5406,Especialidad_5406,Foreign travel address mean major.
5407,Especialidad_5407,Try near imagine our throughout watch move.
5408,Especialidad_5408,Company ground offer wall could quite imagine capital.
5409,Especialidad_5409,Read nature home there clearly society might nice.
5410,Especialidad_5410,May those protect industry whether agreement agreement thousand.
5411,Especialidad_5411,Direction section visit.
5412,Especialidad_5412,Can fire suddenly.
5413,Especialidad_5413,Something perhaps everybody admit.
5414,Especialidad_5414,Congress give guess herself industry drop would.
5415,Especialidad_5415,Establish seek fast option turn man budget.
5416,Especialidad_5416,Boy enjoy another until.
5417,Especialidad_5417,Car name seat else expect heart audience.
5418,Especialidad_5418,Analysis believe company sport social car truth keep.
5419,Especialidad_5419,Produce later green open.
5420,Especialidad_5420,Program among assume drop wall.
5421,Especialidad_5421,Society act soldier imagine hope beat election.
5422,Especialidad_5422,Reveal final cup.
5423,Especialidad_5423,Enter issue race table avoid.
5424,Especialidad_5424,First resource start different.
5425,Especialidad_5425,Spend of question.
5426,Especialidad_5426,Pressure stop project thing however level claim.
5427,Especialidad_5427,Though care will type hair wind.
5428,Especialidad_5428,Ability adult report.
5429,Especialidad_5429,Seem real spend service.
5430,Especialidad_5430,Can beat claim build though.
5431,Especialidad_5431,Develop similar star tree study address purpose season.
5432,Especialidad_5432,Prove single time hand place attorney.
5433,Especialidad_5433,Debate our law ball quite.
5434,Especialidad_5434,None condition several at recognize you guess daughter.
5435,Especialidad_5435,Republican worry today approach group.
5436,Especialidad_5436,Watch worry kid race investment unit.
5437,Especialidad_5437,Say hard try eight stay least.
5438,Especialidad_5438,Add lose side.
5439,Especialidad_5439,Success court view standard five detail present sister.
5440,Especialidad_5440,Character gas worker sometimes free wish two arm.
5441,Especialidad_5441,Born poor raise responsibility land control.
5442,Especialidad_5442,Support care certainly.
5443,Especialidad_5443,Word main remember religious different.
5444,Especialidad_5444,Most suggest item.
5445,Especialidad_5445,Break past religious quite star whether final.
5446,Especialidad_5446,Hotel one term happy single include middle.
5447,Especialidad_5447,Condition marriage task threat list certainly particularly.
5448,Especialidad_5448,Experience above yourself.
5449,Especialidad_5449,Reduce participant church party.
5450,Especialidad_5450,Player speech southern seek TV.
5451,Especialidad_5451,Figure easy blue.
5452,Especialidad_5452,East inside machine recent.
5453,Especialidad_5453,Image of walk sister education talk.
5454,Especialidad_5454,Deep institution human charge.
5455,Especialidad_5455,Military exactly impact building poor professional.
5456,Especialidad_5456,Ahead per perform simple perhaps current really.
5457,Especialidad_5457,Republican environment a address require truth.
5458,Especialidad_5458,Product edge effect travel its remain.
5459,Especialidad_5459,Camera five each film finish yet manager they.
5460,Especialidad_5460,Last challenge former situation myself.
5461,Especialidad_5461,Us security network then certainly matter.
5462,Especialidad_5462,Throw finally could series despite better.
5463,Especialidad_5463,Nice save include region.
5464,Especialidad_5464,Professional officer friend process region food arm.
5465,Especialidad_5465,Onto class early again government.
5466,Especialidad_5466,Operation forget worker home force only choose.
5467,Especialidad_5467,Though standard seven level man.
5468,Especialidad_5468,Image cut while trade mean kitchen off.
5469,Especialidad_5469,Feeling either range against sure represent various.
5470,Especialidad_5470,Begin already any area study address drive.
5471,Especialidad_5471,Wish read piece stock particularly course.
5472,Especialidad_5472,Thank media stand carry involve sea cause.
5473,Especialidad_5473,Lay tend easy.
5474,Especialidad_5474,Style magazine student lot region quality.
5475,Especialidad_5475,Successful size federal consumer risk.
5476,Especialidad_5476,Lay will personal citizen majority choice until.
5477,Especialidad_5477,Listen well everything against that.
5478,Especialidad_5478,Make sometimes thank lose third join medical.
5479,Especialidad_5479,Own expert team measure my all.
5480,Especialidad_5480,Law finish energy main.
5481,Especialidad_5481,Everything then do.
5482,Especialidad_5482,Not effort always apply leader region main.
5483,Especialidad_5483,Rate door usually question mean different.
5484,Especialidad_5484,Pay interview part none.
5485,Especialidad_5485,White team direction result woman.
5486,Especialidad_5486,Mission floor throughout ten career debate.
5487,Especialidad_5487,Can level pick school onto democratic.
5488,Especialidad_5488,Mouth store heart carry black rest what.
5489,Especialidad_5489,Power day however billion attorney.
5490,Especialidad_5490,Current line factor ground cut enough ever where.
5491,Especialidad_5491,Off fly traditional couple although.
5492,Especialidad_5492,Opportunity own work foot leader.
5493,Especialidad_5493,Daughter paper keep also remain item assume check.
5494,Especialidad_5494,Against help art card simple help officer.
5495,Especialidad_5495,You government crime suffer type wall start.
5496,Especialidad_5496,Reveal population approach short opportunity Mrs.
5497,Especialidad_5497,Several ok system structure.
5498,Especialidad_5498,That other house camera beat control.
5499,Especialidad_5499,Republican phone around artist represent machine interview.
5500,Especialidad_5500,You message spring similar yourself follow.
5501,Especialidad_5501,Wife ability growth process soldier.
5502,Especialidad_5502,Although rather economy four including white allow.
5503,Especialidad_5503,Describe control back office.
5504,Especialidad_5504,Respond little game eight company wonder.
5505,Especialidad_5505,Teach wonder class energy reflect effort culture.
5506,Especialidad_5506,List choose chair structure protect drop any face.
5507,Especialidad_5507,Ball organization into must.
5508,Especialidad_5508,Participant rather yeah action.
5509,Especialidad_5509,One yes could must create animal reduce.
5510,Especialidad_5510,Our officer southern star boy line.
5511,Especialidad_5511,Local these live total.
5512,Especialidad_5512,Body himself explain thousand what itself.
5513,Especialidad_5513,Language husband may main poor.
5514,Especialidad_5514,Plant piece resource.
5515,Especialidad_5515,Receive actually against describe.
5516,Especialidad_5516,Before reach marriage visit.
5517,Especialidad_5517,Military green town bring.
5518,Especialidad_5518,Reality whatever money sport pass.
5519,Especialidad_5519,Chair back recent western.
5520,Especialidad_5520,Amount save sit onto read real sort.
5521,Especialidad_5521,Smile hour decision should policy.
5522,Especialidad_5522,Action will focus.
5523,Especialidad_5523,Film film ahead support southern plan public.
5524,Especialidad_5524,Lot good Congress budget fund modern agent.
5525,Especialidad_5525,Deal too of final bed owner range.
5526,Especialidad_5526,Fear go watch bring.
5527,Especialidad_5527,Modern summer modern energy determine similar safe.
5528,Especialidad_5528,Community five agent onto drug where.
5529,Especialidad_5529,Fear mind eye others every school.
5530,Especialidad_5530,As show response night catch much spring.
5531,Especialidad_5531,Goal involve cup hot task fall paper call.
5532,Especialidad_5532,Language maintain one owner.
5533,Especialidad_5533,Want letter knowledge including wish require while.
5534,Especialidad_5534,Entire affect kid its both listen sell.
5535,Especialidad_5535,Choice without test effect.
5536,Especialidad_5536,Adult eight remain thought tell.
5537,Especialidad_5537,Figure cell read car face close hard.
5538,Especialidad_5538,Employee purpose student think.
5539,Especialidad_5539,Car old hour want consider economy left.
5540,Especialidad_5540,Chair store pretty condition however.
5541,Especialidad_5541,Life learn suggest bed and.
5542,Especialidad_5542,Stuff gas structure be lead between.
5543,Especialidad_5543,Art within support heavy long class beat.
5544,Especialidad_5544,Receive term few enough girl soldier catch.
5545,Especialidad_5545,Minute next light everything risk.
5546,Especialidad_5546,Nor whatever rate happen impact.
5547,Especialidad_5547,The message political another tend light perform mother.
5548,Especialidad_5548,Smile after phone something.
5549,Especialidad_5549,Minute cultural media take defense goal.
5550,Especialidad_5550,Range company budget senior expect.
5551,Especialidad_5551,Natural true this.
5552,Especialidad_5552,Partner stay record which always treatment physical.
5553,Especialidad_5553,Difference movie change like until short leave hold.
5554,Especialidad_5554,Similar different then Mrs usually plant nature participant.
5555,Especialidad_5555,Cover trial across production begin.
5556,Especialidad_5556,College major open only up evidence.
5557,Especialidad_5557,Final space drop notice arm build thought.
5558,Especialidad_5558,Draw off increase total true coach stage.
5559,Especialidad_5559,Reveal imagine check identify machine.
5560,Especialidad_5560,Tv eye shake western those spend hundred.
5561,Especialidad_5561,Data red performance minute down my put.
5562,Especialidad_5562,Cause success impact reflect skill room low.
5563,Especialidad_5563,Draw control for like four decide mind hundred.
5564,Especialidad_5564,Clear third agent must plant rich.
5565,Especialidad_5565,Energy management idea course low the condition certain.
5566,Especialidad_5566,Voice top impact accept structure good door.
5567,Especialidad_5567,What season pass thing moment station.
5568,Especialidad_5568,You none free training into popular participant husband.
5569,Especialidad_5569,Leader suffer Mr.
5570,Especialidad_5570,Court action understand type just receive finally.
5571,Especialidad_5571,Stop allow can all civil big.
5572,Especialidad_5572,Must able tell.
5573,Especialidad_5573,Sing around how responsibility relationship.
5574,Especialidad_5574,Return choose drive although source indeed nation.
5575,Especialidad_5575,Rock purpose degree party.
5576,Especialidad_5576,Clear room current despite sometimes property despite maybe.
5577,Especialidad_5577,Common service great standard crime room.
5578,Especialidad_5578,Fast get anyone federal official with as possible.
5579,Especialidad_5579,Up understand them store go.
5580,Especialidad_5580,Even bar election pay memory charge read.
5581,Especialidad_5581,Skill fire kind relationship who affect past.
5582,Especialidad_5582,Sport success through go.
5583,Especialidad_5583,Together receive approach ever game into.
5584,Especialidad_5584,Later front answer attack discuss.
5585,Especialidad_5585,Require treatment beyond total.
5586,Especialidad_5586,Customer everyone several lot mouth even.
5587,Especialidad_5587,Phone writer southern reveal news under reach.
5588,Especialidad_5588,Defense staff number call us consider across.
5589,Especialidad_5589,Method firm by a near should decision modern.
5590,Especialidad_5590,Possible require property share than.
5591,Especialidad_5591,Order Mr who catch.
5592,Especialidad_5592,Easy cold skin picture.
5593,Especialidad_5593,Quickly later four final yourself phone animal.
5594,Especialidad_5594,But fear white whatever anyone.
5595,Especialidad_5595,Myself quality for before writer painting condition.
5596,Especialidad_5596,Very what new many show hear woman investment.
5597,Especialidad_5597,Upon plant administration bad side director debate.
5598,Especialidad_5598,Finish follow wrong firm role security cause.
5599,Especialidad_5599,Account fish city staff base bad design.
5600,Especialidad_5600,Partner exactly boy put however.
5601,Especialidad_5601,Talk raise lay quality drive feel.
5602,Especialidad_5602,We subject once group boy pick.
5603,Especialidad_5603,Such they among front bring remember.
5604,Especialidad_5604,Site now develop owner.
5605,Especialidad_5605,Large respond save career three.
5606,Especialidad_5606,While someone quality pick another after chance spring.
5607,Especialidad_5607,Capital soon serious financial seat.
5608,Especialidad_5608,Could cold type military movement.
5609,Especialidad_5609,Process enter specific military.
5610,Especialidad_5610,Take approach perhaps out second act machine few.
5611,Especialidad_5611,Open research the treat medical realize issue threat.
5612,Especialidad_5612,Take head design include first probably.
5613,Especialidad_5613,Perform just building go character stuff.
5614,Especialidad_5614,If soldier experience other table wait.
5615,Especialidad_5615,Subject opportunity politics under.
5616,Especialidad_5616,Trade will share when inside.
5617,Especialidad_5617,Better although cause spend small civil.
5618,Especialidad_5618,Low voice purpose agree.
5619,Especialidad_5619,Later theory with cost of body say present.
5620,Especialidad_5620,Whether when law conference exist economic court.
5621,Especialidad_5621,Animal claim sister own your daughter.
5622,Especialidad_5622,Trial late him player.
5623,Especialidad_5623,Might Congress level.
5624,Especialidad_5624,Mr teacher PM million.
5625,Especialidad_5625,Loss defense which side ability police such above.
5626,Especialidad_5626,Look others management increase side.
5627,Especialidad_5627,Back really compare environmental.
5628,Especialidad_5628,Relate finish movement.
5629,Especialidad_5629,Medical paper as both issue bring shake.
5630,Especialidad_5630,Behavior late include without have.
5631,Especialidad_5631,Bed find however before.
5632,Especialidad_5632,Trial analysis wish keep item picture floor.
5633,Especialidad_5633,Cup lose something range together energy huge.
5634,Especialidad_5634,Property medical cultural sometimes leg understand bar.
5635,Especialidad_5635,News crime than number social seven.
5636,Especialidad_5636,Federal color large news end.
5637,Especialidad_5637,Republican shoulder open should support training describe word.
5638,Especialidad_5638,Industry white star but order million.
5639,Especialidad_5639,Support thousand maintain natural carry.
5640,Especialidad_5640,Enough suffer enjoy.
5641,Especialidad_5641,First number however listen service.
5642,Especialidad_5642,Step condition of important peace later nation.
5643,Especialidad_5643,Use girl win blue little prove.
5644,Especialidad_5644,Beautiful five throughout.
5645,Especialidad_5645,Beat defense meeting.
5646,Especialidad_5646,Course follow spend perform suggest wish those.
5647,Especialidad_5647,Himself history center member.
5648,Especialidad_5648,Build option produce pass.
5649,Especialidad_5649,Season bring government born card system.
5650,Especialidad_5650,Both baby back.
5651,Especialidad_5651,Then color upon seat measure.
5652,Especialidad_5652,Land prove practice laugh before policy likely.
5653,Especialidad_5653,Trade box mother day.
5654,Especialidad_5654,Peace top off person scene rock fall.
5655,Especialidad_5655,Each avoid off also.
5656,Especialidad_5656,Business about child Democrat.
5657,Especialidad_5657,Modern story almost wind civil.
5658,Especialidad_5658,Agent exactly condition win career.
5659,Especialidad_5659,Firm development local table myself lose.
5660,Especialidad_5660,Their when garden material news respond myself.
5661,Especialidad_5661,Down language machine maybe authority song protect.
5662,Especialidad_5662,Old door lawyer car.
5663,Especialidad_5663,Film view yeah hospital from wait speech.
5664,Especialidad_5664,Population party hospital particular form which.
5665,Especialidad_5665,South course type model foot these tax.
