id_especialidad,nombre,descripcion
1,Especialidad_1,Answer effect ready mission feel get war minute.
2,Especialidad_2,Former position them Congress firm.
3,Especialidad_3,Box start response something agreement around.
4,Especialidad_4,Which travel deep agent work.
5,Especialidad_5,Weight leg agreement artist speech skill.
6,Especialidad_6,Manage year price investment can order reflect support.
7,Especialidad_7,Site direction someone blood cell day thing.
8,Especialidad_8,Shake think affect soldier area.
9,Especialidad_9,Continue here national.
10,Especialidad_10,Upon operation partner enter.
11,Especialidad_11,Spend interview dinner pull form fine trade response.
12,Especialidad_12,Candidate produce tend full heart crime.
13,Especialidad_13,Owner sister change power.
14,Especialidad_14,Sort near development expert tree that interest.
15,Especialidad_15,Day ten last explain note.
16,Especialidad_16,Could now item visit partner million.
17,Especialidad_17,Energy bar detail real task get.
18,Especialidad_18,Word administration list behavior sure law people information.
19,Especialidad_19,How teacher research along sound concern.
20,Especialidad_20,Story small relate create.
21,Especialidad_21,Civil hear change home light federal.
22,Especialidad_22,Face Republican just add enjoy.
23,Especialidad_23,It lead care concern president choose.
24,Especialidad_24,Indeed recognize for stage truth school police land.
25,Especialidad_25,Line late present form.
26,Especialidad_26,Rather free with they.
27,Especialidad_27,Account president instead position most offer.
28,Especialidad_28,Point story too commercial condition grow.
29,Especialidad_29,Feeling often party player head.
30,Especialidad_30,Third fire manage expert adult want.
31,Especialidad_31,Instead service vote.
32,Especialidad_32,To final to have where create.
33,Especialidad_33,Game personal onto sign better condition think.
34,Especialidad_34,Out money hair rich carry south four.
35,Especialidad_35,Development herself economic line herself their.
36,Especialidad_36,Small Republican Democrat forward public phone relate evidence.
37,Especialidad_37,Institution accept peace American meeting responsibility.
38,Especialidad_38,Speak environment space news public bed read.
39,Especialidad_39,Good reflect ready develop think stop artist.
40,Especialidad_40,Own themselves four move garden red enter upon.
41,Especialidad_41,Third goal add each heart be whatever.
42,Especialidad_42,Short by box.
43,Especialidad_43,Second stay laugh believe scene final center.
44,Especialidad_44,Western southern effort themselves including nice.
45,Especialidad_45,Air large dream.
46,Especialidad_46,Meet I rate.
47,Especialidad_47,West summer sound stage real population.
48,Especialidad_48,Decide end way specific majority.
49,Especialidad_49,By discussion century any enjoy me.
50,Especialidad_50,Attorney age event page prove.
51,Especialidad_51,Dream campaign only cost page subject.
52,Especialidad_52,Half couple movie government he hour.
53,Especialidad_53,Father treatment note step prevent modern.
54,Especialidad_54,Heavy current region yourself together drug herself.
55,Especialidad_55,Speech affect charge movie central project.
56,Especialidad_56,Able when senior.
57,Especialidad_57,Response base growth first son window.
58,Especialidad_58,Concern as place Mrs after responsibility.
59,Especialidad_59,How experience media these.
60,Especialidad_60,Quite development group seek he similar.
61,Especialidad_61,Probably everybody candidate exactly husband we lay write.
62,Especialidad_62,Half dream able state.
63,Especialidad_63,Style TV evening police score.
64,Especialidad_64,Understand consider human statement save.
65,Especialidad_65,Direction half value oil edge.
66,Especialidad_66,Control recent soldier degree center draw.
67,Especialidad_67,Dream director clear size make.
68,Especialidad_68,Occur night fine close somebody current.
69,Especialidad_69,Scene of central accept stay your program.
70,Especialidad_70,Old last effort hour student actually quality glass.
71,Especialidad_71,Someone matter night site.
72,Especialidad_72,Remember myself international shoulder recent relationship.
73,Especialidad_73,Involve should seek coach put remember likely.
74,Especialidad_74,Up laugh still western play.
75,Especialidad_75,Range class majority maintain respond finally.
76,Especialidad_76,Race throughout wait computer.
77,Especialidad_77,Guess able scene one any bed.
78,Especialidad_78,Husband line information entire western and.
79,Especialidad_79,Scene of daughter paper rich.
80,Especialidad_80,Majority too it enough system.
81,Especialidad_81,Behind notice these pull term take.
82,Especialidad_82,Serve throw information.
83,Especialidad_83,Box about success argue allow apply poor.
84,Especialidad_84,Effort offer move win.
85,Especialidad_85,Case if government service who trouble door carry.
86,Especialidad_86,Data subject approach development bit response.
87,Especialidad_87,Certain its garden suggest.
88,Especialidad_88,Public future soon white pattern son catch.
89,Especialidad_89,Listen expert budget cut party nearly education.
90,Especialidad_90,Parent seem relate war now if travel.
91,Especialidad_91,Almost debate station night consumer career soldier.
92,Especialidad_92,Large red message.
93,Especialidad_93,Information personal interesting last yet animal discuss.
94,Especialidad_94,Bank instead later what social unit.
95,Especialidad_95,Agent establish table during.
96,Especialidad_96,Huge deal those.
97,Especialidad_97,Worker level put air none strategy.
98,Especialidad_98,Reflect close wait yourself.
99,Especialidad_99,Move system positive big process factor.
100,Especialidad_100,About relationship speak the fly can simple source.
101,Especialidad_101,Give black need sit receive.
102,Especialidad_102,Example myself we identify game despite.
103,Especialidad_103,Million agree else improve.
104,Especialidad_104,Hope rich year partner face.
105,Especialidad_105,Effort song ever alone well for just.
106,Especialidad_106,Raise sister son page.
107,Especialidad_107,Indicate morning her able attention.
108,Especialidad_108,Smile two bring idea.
109,Especialidad_109,Including specific current organization everything.
110,Especialidad_110,Newspaper ask music.
111,Especialidad_111,Piece nearly end issue almost.
112,Especialidad_112,Level eye example turn hold ago.
113,Especialidad_113,Future though sit exist employee seat.
114,Especialidad_114,Seem half executive put.
115,Especialidad_115,Woman what born seat until.
116,Especialidad_116,Raise recognize must executive approach.
117,Especialidad_117,Stand matter large traditional second change.
118,Especialidad_118,Herself road fight floor red create.
119,Especialidad_119,Summer establish after produce move threat.
120,Especialidad_120,Window I health every approach against.
121,Especialidad_121,Stop certain the each research history.
122,Especialidad_122,Court travel sometimes southern.
123,Especialidad_123,Land figure mouth wish tell some star.
124,Especialidad_124,Other general area write.
125,Especialidad_125,New learn plan consider.
126,Especialidad_126,Not chair deep article government.
127,Especialidad_127,Prevent point color play cause themselves.
128,Especialidad_128,Option body may me.
129,Especialidad_129,Left sound early radio support bank.
130,Especialidad_130,Whose spend control style national.
131,Especialidad_131,Customer skill standard five simple bed cultural.
132,Especialidad_132,Close culture factor including.
133,Especialidad_133,Main activity skill low along area.
134,Especialidad_134,Job personal yard bad exist wind street.
135,Especialidad_135,Growth while before amount box appear good body.
136,Especialidad_136,Five phone staff operation.
137,Especialidad_137,Glass born step response future radio.
138,Especialidad_138,Visit you sense benefit magazine generation continue.
139,Especialidad_139,Government herself week run natural because.
140,Especialidad_140,Piece city town training wife return.
141,Especialidad_141,Reveal board nothing itself fall treatment.
142,Especialidad_142,Between evening low east why.
143,Especialidad_143,Sort job across dinner establish material.
144,Especialidad_144,Read defense concern other simple treat any.
145,Especialidad_145,Significant eye or enjoy beyond floor.
146,Especialidad_146,Watch how attack certain.
147,Especialidad_147,Travel kind offer in.
148,Especialidad_148,Apply politics senior last.
149,Especialidad_149,Country in spend mouth similar worker do.
150,Especialidad_150,Player rich remain happen east.
151,Especialidad_151,Growth less mouth face artist audience ten type.
152,Especialidad_152,Name couple senior again mention imagine professional.
153,Especialidad_153,Mother just him modern cultural major.
154,Especialidad_154,Mrs worker to money return blue of.
155,Especialidad_155,Important easy ago social.
156,Especialidad_156,No open loss character leader possible wrong.
157,Especialidad_157,Magazine billion TV usually early.
158,Especialidad_158,Green particular well enjoy around.
159,Especialidad_159,Human population make foreign management response might.
160,Especialidad_160,Product bag actually live however medical camera.
161,Especialidad_161,Crime I individual more.
162,Especialidad_162,Exactly tend executive.
163,Especialidad_163,Individual able serious present.
164,Especialidad_164,Into evening ability miss heavy.
165,Especialidad_165,Case may might political.
166,Especialidad_166,But bring floor positive take specific happy.
167,Especialidad_167,Deep ahead source matter into.
168,Especialidad_168,May easy car simply example.
169,Especialidad_169,On walk woman successful think.
170,Especialidad_170,Worker time and walk approach simply.
171,Especialidad_171,Health use rich TV.
172,Especialidad_172,Air be floor history.
173,Especialidad_173,Until deep central two.
174,Especialidad_174,Success amount since group happen house continue.
175,Especialidad_175,Skill something marriage sister forward.
176,Especialidad_176,Side reduce present scene ready magazine cause.
177,Especialidad_177,Nature owner draw clearly night.
178,Especialidad_178,Reflect effort campaign they father.
179,Especialidad_179,Life particular cold build throughout accept party miss.
180,Especialidad_180,Rise stuff event involve data enter low.
181,Especialidad_181,Pay course anyone alone into order.
182,Especialidad_182,Successful method cut three understand stage performance cultural.
183,Especialidad_183,With none agreement better clear.
184,Especialidad_184,Focus alone science.
185,Especialidad_185,With series note where security role for.
186,Especialidad_186,System son above side mother.
187,Especialidad_187,Camera must arrive end.
188,Especialidad_188,Kitchen get head view.
189,Especialidad_189,Anything list need add support.
190,Especialidad_190,Rich value simple police list official.
191,Especialidad_191,Including factor PM onto.
192,Especialidad_192,Clear after cold investment building.
193,Especialidad_193,Life ground prove audience value my.
194,Especialidad_194,Level compare miss election worry skin.
195,Especialidad_195,Box item mention vote.
196,Especialidad_196,Kitchen we phone fear class future.
197,Especialidad_197,Race magazine a hotel street continue week.
198,Especialidad_198,Room itself billion.
199,Especialidad_199,Firm interest concern energy.
200,Especialidad_200,Build model customer help turn our.
201,Especialidad_201,Bank piece three want.
202,Especialidad_202,Congress Democrat quite yard.
203,Especialidad_203,Traditional from floor worry.
204,Especialidad_204,Mention student capital other firm religious effect.
205,Especialidad_205,Make strong community building.
206,Especialidad_206,Month seek dream deep discover specific.
207,Especialidad_207,Hour until ago price wish lot together TV.
208,Especialidad_208,Between large religious.
209,Especialidad_209,First us quickly stock.
210,Especialidad_210,Themselves plan view five learn.
211,Especialidad_211,Deep less fast first perhaps return much.
212,Especialidad_212,Blood every someone.
213,Especialidad_213,The authority take bill rate.
214,Especialidad_214,Agreement peace whose decade full.
215,Especialidad_215,Treat middle forward minute administration American how.
216,Especialidad_216,Natural color month development specific.
217,Especialidad_217,Piece realize wonder particularly box blood month.
218,Especialidad_218,Hand require pressure American.
219,Especialidad_219,South nice accept.
220,Especialidad_220,Watch people close movie recognize.
221,Especialidad_221,Fight police after better nature light score style.
222,Especialidad_222,Grow today world each recognize run increase number.
223,Especialidad_223,Threat night gun allow.
224,Especialidad_224,Involve lead their sign others station.
225,Especialidad_225,About yeah land thus.
226,Especialidad_226,Traditional investment short.
227,Especialidad_227,Develop whether then word space positive approach suffer.
228,Especialidad_228,Fund city young tonight painting government if.
229,Especialidad_229,Admit star painting food American.
230,Especialidad_230,Artist place large civil outside you.
231,Especialidad_231,Candidate star kid.
232,Especialidad_232,Other street industry produce like.
233,Especialidad_233,Film various race need tell next.
234,Especialidad_234,Paper point third trip energy huge compare.
235,Especialidad_235,Water special operation age power customer.
236,Especialidad_236,Education teacher everyone yeah.
237,Especialidad_237,Current light pass law economic oil.
238,Especialidad_238,Father bad new view else.
239,Especialidad_239,Among manage until.
240,Especialidad_240,Picture those visit mission.
241,Especialidad_241,Travel main relationship exactly piece.
242,Especialidad_242,Adult spend natural case training social.
243,Especialidad_243,Politics nor factor player thing foreign.
244,Especialidad_244,Only would his those red officer official.
245,Especialidad_245,Education seven event number.
246,Especialidad_246,Issue run event under agent challenge.
247,Especialidad_247,Nation imagine election from doctor spend analysis.
248,Especialidad_248,Result view stand size eye live book important.
249,Especialidad_249,Civil rule special believe candidate meet property himself.
250,Especialidad_250,Remain way billion much will person.
251,Especialidad_251,Happy card glass dog.
252,Especialidad_252,Firm coach smile late.
253,Especialidad_253,Mission such police.
254,Especialidad_254,Truth increase summer vote year table.
255,Especialidad_255,Part as production ten phone throw.
256,Especialidad_256,Sometimes onto paper to before.
257,Especialidad_257,Write people side camera chance minute.
258,Especialidad_258,Few recently decade consumer catch billion successful indicate.
259,Especialidad_259,Level want according future organization machine.
260,Especialidad_260,Beat within behavior it.
261,Especialidad_261,Get window later recognize her eye result.
262,Especialidad_262,Middle child leg soon enjoy us newspaper.
263,Especialidad_263,Account more rule outside actually raise.
264,Especialidad_264,Leader plant go another research century art.
265,Especialidad_265,Enter human staff together wait win while.
266,Especialidad_266,Change which how go seat free reveal.
267,Especialidad_267,Federal order listen would democratic guy.
268,Especialidad_268,Seek worry they artist tell evening.
269,Especialidad_269,Cultural American card paper.
270,Especialidad_270,Magazine strategy three discuss.
271,Especialidad_271,Each will relate crime law million couple.
272,Especialidad_272,Radio call a down traditional.
273,Especialidad_273,Letter easy grow house ball manager.
274,Especialidad_274,Majority increase pick general address season teacher.
275,Especialidad_275,Really follow heart.
276,Especialidad_276,Nearly wall offer reveal deep.
277,Especialidad_277,Professional huge world school building send style.
278,Especialidad_278,Product reflect involve itself score executive race.
279,Especialidad_279,You available far maintain idea when.
280,Especialidad_280,Recently focus study very.
281,Especialidad_281,Part manager though smile sister laugh really bed.
282,Especialidad_282,Coach possible until court important foreign.
283,Especialidad_283,Stop beat machine.
284,Especialidad_284,Together station much name.
285,Especialidad_285,Point over sometimes.
286,Especialidad_286,Television seem sport late ten left.
287,Especialidad_287,Western surface safe yourself.
288,Especialidad_288,Within without dream face career six bed.
289,Especialidad_289,Major brother two health sport.
290,Especialidad_290,Successful land difference article worker quickly dinner.
291,Especialidad_291,Picture begin business.
292,Especialidad_292,Create camera create give drug.
293,Especialidad_293,His subject staff kid use machine natural west.
294,Especialidad_294,If can interview book maybe pattern.
295,Especialidad_295,Still argue nor of issue finish.
296,Especialidad_296,Strategy already meet.
297,Especialidad_297,Account production pull city.
298,Especialidad_298,North hear outside seat security key manager test.
299,Especialidad_299,Wife politics traditional option between issue wall.
300,Especialidad_300,Really time news road here member.
301,Especialidad_301,Common read page themselves where second.
302,Especialidad_302,Add other event of leg know.
303,Especialidad_303,Find create mind today.
304,Especialidad_304,Much especially rest fear yard among.
305,Especialidad_305,Single late style certain.
306,Especialidad_306,Care laugh seven purpose.
307,Especialidad_307,Nice stop rule free shoulder tend pass area.
308,Especialidad_308,Manage begin if design experience short better.
309,Especialidad_309,Effect even play move once be.
310,Especialidad_310,Worker training tend commercial way.
311,Especialidad_311,History read cost.
312,Especialidad_312,Development say direction sound against field.
313,Especialidad_313,Worry sea less policy stop safe.
314,Especialidad_314,Property worker shoulder throw.
315,Especialidad_315,Onto however significant.
316,Especialidad_316,Positive staff ready may Mr read upon.
317,Especialidad_317,Black evening brother close home measure usually whatever.
318,Especialidad_318,Business plant our let.
319,Especialidad_319,Anything again laugh modern open support success.
320,Especialidad_320,Yes identify low.
321,Especialidad_321,Evidence reflect treat box.
322,Especialidad_322,Because whose ahead speech type shoulder.
323,Especialidad_323,Goal community card teach help bit.
324,Especialidad_324,Structure care must near certain power compare.
325,Especialidad_325,Southern quickly new figure election game.
326,Especialidad_326,Sell rest address computer shake probably back.
327,Especialidad_327,Indeed road night include house participant.
328,Especialidad_328,Land development enough choice.
329,Especialidad_329,Image would doctor represent democratic.
330,Especialidad_330,Successful ahead edge leg off receive develop.
331,Especialidad_331,Age win both.
332,Especialidad_332,Become news offer.
333,Especialidad_333,Medical remain doctor include usually.
334,Especialidad_334,Fund town then performance suggest.
335,Especialidad_335,Lawyer week activity serious source.
336,Especialidad_336,Cut soldier country.
337,Especialidad_337,Policy character Democrat.
338,Especialidad_338,Trade strong buy community big.
339,Especialidad_339,Grow building PM strong agree job record.
340,Especialidad_340,Dark decide area final project.
341,Especialidad_341,Red require what scientist entire.
342,Especialidad_342,Film bed kitchen small entire.
343,Especialidad_343,Star ok small where miss.
344,Especialidad_344,Sign head worry analysis hold follow region.
345,Especialidad_345,Better dog home summer action.
346,Especialidad_346,Artist he agent society worker green interesting different.
347,Especialidad_347,Political our sure resource.
348,Especialidad_348,Huge pass fast.
349,Especialidad_349,Personal country leg view study.
350,Especialidad_350,Issue officer want size.
351,Especialidad_351,I however bring fast air culture.
352,Especialidad_352,Pretty management group positive alone laugh.
353,Especialidad_353,Meet tax blood single chair follow.
354,Especialidad_354,War later alone information.
355,Especialidad_355,Late produce before back.
356,Especialidad_356,Peace author add form business.
357,Especialidad_357,Onto article memory want exist.
358,Especialidad_358,Process water history billion partner learn.
359,Especialidad_359,Reality rise fly themselves.
360,Especialidad_360,Energy light write everyone.
361,Especialidad_361,In item rich total.
362,Especialidad_362,Prove hospital second different account.
363,Especialidad_363,Where him mother style.
364,Especialidad_364,Work where this door laugh the training road.
365,Especialidad_365,Week than same.
366,Especialidad_366,Floor make their ten hair position figure.
367,Especialidad_367,International south speak continue.
368,Especialidad_368,Pretty network house fight.
369,Especialidad_369,Seek student serious water southern.
370,Especialidad_370,Successful outside ready.
371,Especialidad_371,Away fight billion write listen.
372,Especialidad_372,Explain under before.
373,Especialidad_373,Training task claim offer chance.
374,Especialidad_374,City do year room simple before.
375,Especialidad_375,Reflect sport ask.
376,Especialidad_376,Fall make skin amount true.
377,Especialidad_377,Respond fast what everything.
378,Especialidad_378,Part war chair.
379,Especialidad_379,Because line reveal particular.
380,Especialidad_380,I stage morning food training part.
381,Especialidad_381,Lead suffer case.
382,Especialidad_382,Artist again somebody after.
383,Especialidad_383,State century range voice.
384,Especialidad_384,Game able paper stand.
385,Especialidad_385,Various foot maybe share reach television light.
386,Especialidad_386,Painting key become interest.
387,Especialidad_387,Rate whole human pass wide east little.
388,Especialidad_388,Apply city themselves great.
389,Especialidad_389,Democratic back yourself.
390,Especialidad_390,Health truth design PM.
391,Especialidad_391,Increase interview attorney.
392,Especialidad_392,Behind moment cause short page.
393,Especialidad_393,Organization well public away seek bank.
394,Especialidad_394,Nothing relate perhaps.
395,Especialidad_395,Yeah yes one pass Mr.
396,Especialidad_396,Teach bed probably.
397,Especialidad_397,Trial stock myself.
398,Especialidad_398,Rich turn evidence.
399,Especialidad_399,Research safe know believe boy.
400,Especialidad_400,Case important manage media beyond series air.
401,Especialidad_401,Season admit need yeah ball address former.
402,Especialidad_402,Order everybody campaign people other change.
403,Especialidad_403,Civil energy agency without increase although.
404,Especialidad_404,Sell her doctor character challenge hot.
405,Especialidad_405,Evening interesting military.
406,Especialidad_406,Choose real certain fast company assume.
407,Especialidad_407,Few third structure write case pressure direction.
408,Especialidad_408,How oil out interview exist model.
409,Especialidad_409,Reality rather your help.
410,Especialidad_410,Throughout forget court will east but dog.
411,Especialidad_411,Exist country care difficult.
412,Especialidad_412,Focus catch clear site.
413,Especialidad_413,Fine color investment level.
414,Especialidad_414,Role back education trouble amount arm.
415,Especialidad_415,Performance rather force quickly every per.
416,Especialidad_416,Hold need movement will take thing.
417,Especialidad_417,Huge suffer especially hit single degree.
418,Especialidad_418,Method wear church hit degree.
419,Especialidad_419,Them once drop close.
420,Especialidad_420,Identify phone phone stop generation present total suffer.
421,Especialidad_421,Structure do near let.
422,Especialidad_422,Alone analysis available choose.
423,Especialidad_423,Produce executive education practice box American.
424,Especialidad_424,Firm issue seat crime do every become fall.
425,Especialidad_425,Sometimes including century quality.
426,Especialidad_426,Turn letter set under.
427,Especialidad_427,Common protect pressure common.
428,Especialidad_428,Church thing build reason few strategy.
429,Especialidad_429,Like leave after avoid simple.
430,Especialidad_430,Politics reduce next often.
431,Especialidad_431,Themselves least information factor need policy.
432,Especialidad_432,Defense bring true rich mean might item.
433,Especialidad_433,Above security ok street tell write.
434,Especialidad_434,Billion about get.
435,Especialidad_435,Whatever nation to sound.
436,Especialidad_436,Those American know contain site.
437,Especialidad_437,Seat environment less station community have international.
438,Especialidad_438,To go wide evening trip.
439,Especialidad_439,Dark pick your question own future movement.
440,Especialidad_440,Outside reflect out first age born it.
441,Especialidad_441,During usually particularly lay market nor ahead.
442,Especialidad_442,Song me put work sing religious.
443,Especialidad_443,Wide leg example fear.
444,Especialidad_444,Decade space beautiful decide garden.
445,Especialidad_445,Always public reflect deep pressure natural sometimes.
446,Especialidad_446,Student onto number enough.
447,Especialidad_447,Minute tell hand.
448,Especialidad_448,Ground single main no use rather ask.
449,Especialidad_449,Training side fire half program.
450,Especialidad_450,Ready positive should green tree face land.
451,Especialidad_451,Few affect tonight do mean list fish.
452,Especialidad_452,East detail wind crime toward.
453,Especialidad_453,Number drug fact lot month friend meeting.
454,Especialidad_454,Have walk each party sell both.
455,Especialidad_455,Standard whether suffer.
456,Especialidad_456,Report scene age issue growth.
457,Especialidad_457,Else experience add could leg lawyer technology.
458,Especialidad_458,Increase him news picture example.
