id_especialidad,nombre,descripcion
2630,Especialidad_2630,Either go ask race.
2631,Especialidad_2631,Heavy president American local box owner.
2632,Especialidad_2632,Manager decision pretty fear.
2633,Especialidad_2633,Question indicate economy.
2634,Especialidad_2634,International choice enter wonder.
2635,Especialidad_2635,Decide end include against kid like father.
2636,Especialidad_2636,Forward entire stock sort.
2637,Especialidad_2637,Safe firm hear floor body.
2638,Especialidad_2638,Though conference friend people.
2639,Especialidad_2639,Join myself effect benefit song case raise.
2640,Especialidad_2640,West prevent wind music us news.
2641,Especialidad_2641,Follow image want contain loss bad.
2642,Especialidad_2642,Our six simple affect own.
2643,Especialidad_2643,Music record eat crime clear opportunity.
2644,Especialidad_2644,Drug fast interest report talk our build.
2645,Especialidad_2645,Next office training fact become.
2646,Especialidad_2646,We or seek.
2647,Especialidad_2647,Party meeting drive phone quite.
2648,Especialidad_2648,Leave prove appear say toward.
2649,Especialidad_2649,Several old act rule education protect protect.
2650,Especialidad_2650,Against act find he answer personal citizen.
2651,Especialidad_2651,Year attack ahead none leg feeling break together.
2652,Especialidad_2652,Least hundred example often something year.
2653,Especialidad_2653,Learn particularly young cold section account.
2654,Especialidad_2654,Entire relationship for movie fight perform.
2655,Especialidad_2655,Eat listen oil all several church.
2656,Especialidad_2656,Newspaper hit possible race number people.
2657,Especialidad_2657,Stage three space.
2658,Especialidad_2658,Hotel trial movie any capital.
2659,Especialidad_2659,Employee father product quality radio.
2660,Especialidad_2660,Here expect easy offer.
2661,Especialidad_2661,Across tree hour statement.
2662,Especialidad_2662,Kind reflect trial activity beautiful door shake.
2663,Especialidad_2663,Seem bad father whole friend yes.
2664,Especialidad_2664,Senior employee truth head discuss magazine.
2665,Especialidad_2665,Matter herself between level our.
2666,Especialidad_2666,Understand matter provide.
2667,Especialidad_2667,Store begin technology size avoid ball.
2668,Especialidad_2668,Three bring school because size.
2669,Especialidad_2669,Well candidate voice name model get.
2670,Especialidad_2670,First act trip among there seem.
2671,Especialidad_2671,Piece brother hair summer pattern.
2672,Especialidad_2672,Fund say lay color theory same.
2673,Especialidad_2673,Third section trip quite now.
2674,Especialidad_2674,Notice particular find interest.
2675,Especialidad_2675,Agree tonight clear you say always.
2676,Especialidad_2676,Prepare soon series any case behavior television college.
2677,Especialidad_2677,Group billion gun might remain charge very.
2678,Especialidad_2678,Mrs no rock visit reason resource account.
2679,Especialidad_2679,Form anyone record again design involve administration.
2680,Especialidad_2680,Their several something future leader art morning save.
2681,Especialidad_2681,Hit smile thus enough score property.
2682,Especialidad_2682,Pattern require senior religious.
2683,Especialidad_2683,Support act later traditional most wide.
2684,Especialidad_2684,Choose look page any.
2685,Especialidad_2685,Point strong return pass interesting often against.
2686,Especialidad_2686,Because operation whether anything current defense language.
2687,Especialidad_2687,Provide direction court open.
2688,Especialidad_2688,Power news answer must concern dog management.
2689,Especialidad_2689,Improve discover century far.
2690,Especialidad_2690,Future fall goal sing can enjoy region catch.
2691,Especialidad_2691,Course firm about laugh without single our nearly.
2692,Especialidad_2692,Brother if suggest skill though.
2693,Especialidad_2693,Religious establish Mr participant season.
2694,Especialidad_2694,President just book song.
2695,Especialidad_2695,Lot against assume others fact plant agent well.
2696,Especialidad_2696,Baby southern role form draw five stage.
2697,Especialidad_2697,They understand reduce language political.
2698,Especialidad_2698,Quite TV put.
2699,Especialidad_2699,War situation thank cut kind defense prevent.
2700,Especialidad_2700,Reality PM air ever peace base forget and.
2701,Especialidad_2701,Though their office like month check.
2702,Especialidad_2702,Foot standard her last affect determine dog.
2703,Especialidad_2703,Represent tonight camera point simple.
2704,Especialidad_2704,Policy film past better again.
2705,Especialidad_2705,Choose dark trial throughout article together.
2706,Especialidad_2706,Will inside yard culture.
2707,Especialidad_2707,Mean person truth.
2708,Especialidad_2708,Must change pass entire where black.
2709,Especialidad_2709,Hotel practice sport dog she.
2710,Especialidad_2710,Unit five quickly son pretty.
2711,Especialidad_2711,Level toward manage organization bed government buy.
2712,Especialidad_2712,Painting young writer kind degree.
2713,Especialidad_2713,Health none night glass add easy.
2714,Especialidad_2714,Fly end reveal deep magazine do week miss.
2715,Especialidad_2715,Rather event record hold participant.
2716,Especialidad_2716,Surface easy example other break send.
2717,Especialidad_2717,Low phone west age.
2718,Especialidad_2718,Quite look area light must.
2719,Especialidad_2719,Under family product piece hand deal knowledge.
2720,Especialidad_2720,Care wall shoulder.
2721,Especialidad_2721,Drop especially interest parent yes whether.
2722,Especialidad_2722,Top technology later include investment kid.
2723,Especialidad_2723,From attack nothing sit itself.
2724,Especialidad_2724,To stock quite present Democrat arrive.
2725,Especialidad_2725,End it skill north reality gas student.
2726,Especialidad_2726,Also knowledge image manage.
2727,Especialidad_2727,Begin sign task type avoid easy.
2728,Especialidad_2728,Least a hit audience growth know message.
2729,Especialidad_2729,Paper her better different project bank.
2730,Especialidad_2730,New population difference their wide.
2731,Especialidad_2731,Baby defense capital everything defense deal contain.
2732,Especialidad_2732,Your make show.
2733,Especialidad_2733,Manager have without house.
2734,Especialidad_2734,Character despite walk line sister both environmental.
2735,Especialidad_2735,Spring contain alone cold work draw try computer.
2736,Especialidad_2736,Measure cell alone education finally require.
2737,Especialidad_2737,Interview fire pattern lot.
2738,Especialidad_2738,Production anyone body meeting learn song.
2739,Especialidad_2739,Road hope response citizen score physical face.
2740,Especialidad_2740,Stay professor involve activity no history which.
2741,Especialidad_2741,They these break often anyone beautiful.
2742,Especialidad_2742,Hour last free peace scientist after half.
2743,Especialidad_2743,Character instead name medical these week.
2744,Especialidad_2744,Worker one always wind huge energy happen.
2745,Especialidad_2745,Page view outside family take vote health.
2746,Especialidad_2746,Able dinner fish lay any southern skin.
2747,Especialidad_2747,Top phone body street the health.
2748,Especialidad_2748,Establish last one front arm particularly.
2749,Especialidad_2749,Soldier seat rather start determine return.
2750,Especialidad_2750,Pay until ever three past health today.
2751,Especialidad_2751,Southern as mouth true good treatment.
2752,Especialidad_2752,Firm lose rule same marriage how treatment.
2753,Especialidad_2753,Condition room kid bill maintain above accept others.
2754,Especialidad_2754,Director mother issue read garden change financial.
2755,Especialidad_2755,Various card huge compare threat.
2756,Especialidad_2756,Third much either range financial fire.
2757,Especialidad_2757,Probably force difference decide vote miss.
2758,Especialidad_2758,Behavior read possible image operation and.
2759,Especialidad_2759,East different activity let read.
2760,Especialidad_2760,Daughter director difficult any.
2761,Especialidad_2761,Check indeed and leg seat.
2762,Especialidad_2762,Fly career dream institution daughter yeah.
2763,Especialidad_2763,Off bad coach attention third.
2764,Especialidad_2764,List adult head job about party cost network.
2765,Especialidad_2765,Success think trouble high.
2766,Especialidad_2766,Deep chair notice no.
2767,Especialidad_2767,But kitchen any.
2768,Especialidad_2768,Green born budget recently direction.
2769,Especialidad_2769,Whole pressure color success under commercial television.
2770,Especialidad_2770,Picture view allow billion strong agreement outside.
2771,Especialidad_2771,Size among difference learn.
2772,Especialidad_2772,Truth experience low center impact man career.
2773,Especialidad_2773,Exactly cold let defense weight painting maintain prove.
2774,Especialidad_2774,Card rock employee current.
2775,Especialidad_2775,Hold three little maintain husband suddenly same.
2776,Especialidad_2776,Each although personal nearly create position how.
2777,Especialidad_2777,Buy message peace such next.
2778,Especialidad_2778,End very rate present chance.
2779,Especialidad_2779,Which describe bank happen wrong represent open.
2780,Especialidad_2780,You hand in wall.
2781,Especialidad_2781,Clear Congress into fine box notice.
2782,Especialidad_2782,Focus before explain discussion fish.
2783,Especialidad_2783,Total response federal never force not impact full.
2784,Especialidad_2784,Benefit score total condition magazine quite actually.
2785,Especialidad_2785,Upon tough method memory along factor across despite.
2786,Especialidad_2786,Certainly best because forget.
2787,Especialidad_2787,Into though case special perform hotel owner hot.
2788,Especialidad_2788,School player culture development industry probably name parent.
2789,Especialidad_2789,Opportunity buy individual station now.
2790,Especialidad_2790,Too account resource nothing yard.
2791,Especialidad_2791,Thousand young collection left.
2792,Especialidad_2792,Skill purpose continue environmental produce building shake draw.
2793,Especialidad_2793,Usually bring investment apply direction.
2794,Especialidad_2794,Technology hand manager father should phone.
2795,Especialidad_2795,Push nation public.
2796,Especialidad_2796,Ground maybe strong just.
2797,Especialidad_2797,Economic great push discussion medical.
2798,Especialidad_2798,Fact difficult pretty worry establish.
2799,Especialidad_2799,Weight other his certainly pull beat.
2800,Especialidad_2800,Bad exactly contain type career.
2801,Especialidad_2801,Population would need man item.
2802,Especialidad_2802,Former program also design watch west.
2803,Especialidad_2803,Six news single discover new.
2804,Especialidad_2804,Hit book TV figure nor feeling simple.
2805,Especialidad_2805,Act ten test.
2806,Especialidad_2806,Population practice throw it minute often.
2807,Especialidad_2807,Down involve final same.
2808,Especialidad_2808,Bank me son group pressure too big.
2809,Especialidad_2809,Training positive half.
2810,Especialidad_2810,Occur total pretty boy amount.
2811,Especialidad_2811,Before stuff sound their.
2812,Especialidad_2812,Whole west government room people.
2813,Especialidad_2813,Appear foreign out deal little political.
2814,Especialidad_2814,Newspaper sometimes hold certainly begin force finish.
2815,Especialidad_2815,Event my film.
2816,Especialidad_2816,This case able tough man then kitchen account.
2817,Especialidad_2817,Spring nature hit ball fly.
2818,Especialidad_2818,Put gas raise prepare everyone painting itself.
2819,Especialidad_2819,Term night news front partner.
2820,Especialidad_2820,Right story car thousand strong.
2821,Especialidad_2821,Personal serious fact bill store investment.
2822,Especialidad_2822,Mention product far price.
2823,Especialidad_2823,Education history certain two.
2824,Especialidad_2824,Add someone business subject.
2825,Especialidad_2825,Serious town card campaign they.
2826,Especialidad_2826,Manage board change sense moment line you.
2827,Especialidad_2827,Event happen upon onto.
2828,Especialidad_2828,Per stop thought.
2829,Especialidad_2829,Manage concern simply whatever read.
2830,Especialidad_2830,Defense place blood large.
2831,Especialidad_2831,Feel ability herself section ask other.
2832,Especialidad_2832,Other difficult outside ago.
2833,Especialidad_2833,Price big result represent.
2834,Especialidad_2834,Responsibility pretty today give father.
2835,Especialidad_2835,Maintain seem reason performance.
2836,Especialidad_2836,Industry scientist mouth see.
2837,Especialidad_2837,Bad former attack.
2838,Especialidad_2838,Debate off along suddenly early such near.
2839,Especialidad_2839,Phone hand plant response.
2840,Especialidad_2840,Include alone thought break.
2841,Especialidad_2841,Church sea act more size performance side become.
2842,Especialidad_2842,Alone cover yet born.
2843,Especialidad_2843,Rule car toward.
2844,Especialidad_2844,Never art watch easy.
2845,Especialidad_2845,Spring recently away collection training out they.
2846,Especialidad_2846,Value war any truth save week.
2847,Especialidad_2847,Nor cold from score direction feel there.
2848,Especialidad_2848,Series production teacher it.
2849,Especialidad_2849,Here new about near treat.
2850,Especialidad_2850,Pass contain television body collection.
2851,Especialidad_2851,West debate significant painting color.
2852,Especialidad_2852,Part begin choice style official.
2853,Especialidad_2853,Soon day pick small oil send.
2854,Especialidad_2854,Tonight story great though seven.
2855,Especialidad_2855,Movie second social road physical.
2856,Especialidad_2856,Them degree direction here too wait.
2857,Especialidad_2857,Least sound here practice.
2858,Especialidad_2858,Various picture parent forget source use.
2859,Especialidad_2859,Decade ready place.
2860,Especialidad_2860,Task born may look.
2861,Especialidad_2861,Herself machine interesting point.
2862,Especialidad_2862,Effort adult worry including middle meeting production.
2863,Especialidad_2863,Behind recently go office.
2864,Especialidad_2864,Discuss finish pull consider personal.
2865,Especialidad_2865,Sort scientist test benefit city.
2866,Especialidad_2866,Space you at miss lead reason.
2867,Especialidad_2867,Matter there wide their though before.
2868,Especialidad_2868,Focus visit reach political people mouth.
2869,Especialidad_2869,Drive hard power voice.
2870,Especialidad_2870,Themselves picture add mouth.
2871,Especialidad_2871,Easy thought machine memory.
2872,Especialidad_2872,Activity accept necessary power start process plant.
2873,Especialidad_2873,Room say score hair common eat.
2874,Especialidad_2874,Break base game another above understand fund.
2875,Especialidad_2875,Best rest model.
2876,Especialidad_2876,Specific most various certain financial.
2877,Especialidad_2877,Industry office back his close.
2878,Especialidad_2878,Debate natural believe black.
2879,Especialidad_2879,Source bill nation require.
2880,Especialidad_2880,Ask across onto reveal.
2881,Especialidad_2881,Area writer crime treat medical good.
2882,Especialidad_2882,Mr career exist research.
2883,Especialidad_2883,Born ask with particularly management officer.
2884,Especialidad_2884,Such lot yard bring buy.
2885,Especialidad_2885,Decade condition single step.
2886,Especialidad_2886,Safe billion win career size full.
2887,Especialidad_2887,East particularly program lose each.
2888,Especialidad_2888,Indeed development money lay.
2889,Especialidad_2889,Key knowledge collection area.
2890,Especialidad_2890,When serious site guy rise clearly certain.
2891,Especialidad_2891,Wonder well already sound lot.
2892,Especialidad_2892,Discover quality trade name could speech face.
2893,Especialidad_2893,If bar cup manager.
2894,Especialidad_2894,Lawyer various somebody science reveal.
2895,Especialidad_2895,Former have knowledge quality return others with evidence.
2896,Especialidad_2896,Ten even size book each.
2897,Especialidad_2897,Number economy meet practice activity safe.
2898,Especialidad_2898,Notice worker man indicate ahead car will Republican.
2899,Especialidad_2899,Black majority traditional fill time.
2900,Especialidad_2900,Goal here realize exist page follow as.
2901,Especialidad_2901,Forget voice growth his build discover.
2902,Especialidad_2902,Draw along doctor.
2903,Especialidad_2903,Teach happy education.
2904,Especialidad_2904,Lead many size member reveal tax project.
2905,Especialidad_2905,Own condition total minute similar quality open.
2906,Especialidad_2906,Spring student put.
2907,Especialidad_2907,After way major while defense majority senior.
2908,Especialidad_2908,Ten entire long.
2909,Especialidad_2909,Hold arm movie between.
2910,Especialidad_2910,Task attorney foot state or claim.
2911,Especialidad_2911,Nor accept nice market.
2912,Especialidad_2912,Huge cup maintain condition.
2913,Especialidad_2913,Budget student successful field plan experience yourself.
2914,Especialidad_2914,Animal cultural yet toward discuss.
2915,Especialidad_2915,Wall do laugh method girl.
2916,Especialidad_2916,Loss deep actually his.
2917,Especialidad_2917,Bank road kitchen prove growth.
2918,Especialidad_2918,Other beat way city.
2919,Especialidad_2919,Sell take outside political senior best general.
2920,Especialidad_2920,Other party available run seven both.
2921,Especialidad_2921,Know subject stock keep rich computer.
2922,Especialidad_2922,Beat simply official others adult state cup.
2923,Especialidad_2923,Save still six road ask adult.
2924,Especialidad_2924,Opportunity baby season different.
2925,Especialidad_2925,Box collection wall color.
2926,Especialidad_2926,Upon security blue theory.
2927,Especialidad_2927,Education war human catch.
2928,Especialidad_2928,Bar finish serve out position many.
2929,Especialidad_2929,Gun city national attention.
2930,Especialidad_2930,Field north home no church important.
2931,Especialidad_2931,Lot career summer change often project.
2932,Especialidad_2932,Right program boy source never treatment they.
2933,Especialidad_2933,Worry your involve thousand.
2934,Especialidad_2934,Allow statement dinner box already heart nature wonder.
2935,Especialidad_2935,Personal professor allow claim.
2936,Especialidad_2936,Enough around drop along sometimes a election.
2937,Especialidad_2937,Wife white wish real time assume.
2938,Especialidad_2938,Eat face section structure.
2939,Especialidad_2939,Wide hope goal some decide political than leave.
2940,Especialidad_2940,Ago three measure concern case.
2941,Especialidad_2941,Drug painting director high agency professional entire event.
2942,Especialidad_2942,Memory effect responsibility politics kitchen team community.
2943,Especialidad_2943,Watch past blood interest after smile.
2944,Especialidad_2944,Painting who should town military.
2945,Especialidad_2945,Do main then letter.
2946,Especialidad_2946,Stop city choice best enough seek focus.
2947,Especialidad_2947,Study no administration society hundred.
2948,Especialidad_2948,Shake understand everyone something.
2949,Especialidad_2949,Surface sure artist phone find official allow.
2950,Especialidad_2950,We already prevent.
2951,Especialidad_2951,Agent discover happen court my me nor.
2952,Especialidad_2952,Scientist major over road turn avoid nature interest.
2953,Especialidad_2953,Operation information clear employee what a night focus.
2954,Especialidad_2954,Chance up serious section hundred five.
2955,Especialidad_2955,Growth parent yeah yes since player.
2956,Especialidad_2956,Rest miss state mission hair foreign fine.
2957,Especialidad_2957,Thank maybe grow apply seek.
2958,Especialidad_2958,Offer even through national.
2959,Especialidad_2959,Free reach lawyer recently worry floor my enter.
2960,Especialidad_2960,Effort good put compare Republican.
2961,Especialidad_2961,Have plant may with.
2962,Especialidad_2962,Car consumer card foot blood happen strong.
2963,Especialidad_2963,Crime window budget modern eat marriage.
2964,Especialidad_2964,Be red avoid better these.
2965,Especialidad_2965,Enjoy if within.
2966,Especialidad_2966,Together week it concern.
2967,Especialidad_2967,Describe include bring.
2968,Especialidad_2968,Measure everybody care hit catch person break reason.
2969,Especialidad_2969,Finally bad life serve.
2970,Especialidad_2970,Party pattern break factor.
2971,Especialidad_2971,Table in enough here however.
2972,Especialidad_2972,Hard you chance view people toward.
2973,Especialidad_2973,Popular him live final oil.
2974,Especialidad_2974,Sometimes occur assume page interest.
2975,Especialidad_2975,None expect part we.
2976,Especialidad_2976,Style would wish old up truth rate.
2977,Especialidad_2977,Tend whom usually quickly wrong PM rate.
2978,Especialidad_2978,Prepare despite job team.
2979,Especialidad_2979,North company simple.
2980,Especialidad_2980,Score protect guess learn.
2981,Especialidad_2981,Paper number admit impact federal course safe mouth.
2982,Especialidad_2982,Suddenly example single morning however.
2983,Especialidad_2983,Suffer effect prove green follow.
2984,Especialidad_2984,He more bill another decide still.
2985,Especialidad_2985,Mind score mind their guess how main.
2986,Especialidad_2986,Data factor behavior partner.
2987,Especialidad_2987,Room nearly physical campaign around create reality.
2988,Especialidad_2988,Provide themselves mean why produce soldier.
2989,Especialidad_2989,Value number too operation talk look.
2990,Especialidad_2990,Sing federal because.
2991,Especialidad_2991,Seat prepare decide difference reality many agree part.
2992,Especialidad_2992,About what break weight.
2993,Especialidad_2993,Sit animal season pick age.
2994,Especialidad_2994,Land this there name fly down.
2995,Especialidad_2995,Ready institution word PM project official first.
2996,Especialidad_2996,Artist size huge physical.
2997,Especialidad_2997,Hair bed strategy trade believe development guess.
2998,Especialidad_2998,Player mean and evidence evidence.
2999,Especialidad_2999,Medical network its born manager.
3000,Especialidad_3000,So wear security provide analysis.
3001,Especialidad_3001,Mind food point choose.
3002,Especialidad_3002,Interesting if computer open themselves manage which.
3003,Especialidad_3003,Mother charge according organization specific whether north.
3004,Especialidad_3004,Miss letter else soldier finally boy.
3005,Especialidad_3005,Return center method happy thought make.
3006,Especialidad_3006,Industry seat choice amount lawyer.
3007,Especialidad_3007,Dream nor not method personal.
3008,Especialidad_3008,Light any recognize vote Congress economy.
3009,Especialidad_3009,Fine during huge drop must.
3010,Especialidad_3010,Different positive work month chair production.
3011,Especialidad_3011,New cultural present interest.
3012,Especialidad_3012,Ask edge work final something.
3013,Especialidad_3013,Hospital recently political security hope computer.
3014,Especialidad_3014,Blue anything peace us between first cell.
3015,Especialidad_3015,Military item describe per.
3016,Especialidad_3016,Speech other administration employee.
3017,Especialidad_3017,Rule design she cut.
3018,Especialidad_3018,Of last season sister southern adult authority.
3019,Especialidad_3019,Sea owner write reason.
3020,Especialidad_3020,Area once old material.
3021,Especialidad_3021,Among return pressure sit shake.
3022,Especialidad_3022,Decision almost understand live.
3023,Especialidad_3023,Maybe subject son human.
3024,Especialidad_3024,Skin bag chance nothing population nature.
3025,Especialidad_3025,Suffer table rock doctor often tax.
3026,Especialidad_3026,Enjoy tough important station off whatever.
3027,Especialidad_3027,Blue protect simply mouth game recent.
3028,Especialidad_3028,Hope source economic military authority.
3029,Especialidad_3029,Picture difference answer growth power base care a.
3030,Especialidad_3030,All available yourself street skin send continue.
3031,Especialidad_3031,South six officer thousand.
3032,Especialidad_3032,Parent cup under nation actually author.
3033,Especialidad_3033,Director talk decision.
3034,Especialidad_3034,Agent kind partner space recent chair political important.
3035,Especialidad_3035,Control pass serious.
3036,Especialidad_3036,Brother summer easy bed class serious executive.
3037,Especialidad_3037,Service hard forget side quickly enough.
3038,Especialidad_3038,History machine find until certain lawyer mind.
3039,Especialidad_3039,Music call lay issue girl.
3040,Especialidad_3040,Mrs watch mission goal art sing.
3041,Especialidad_3041,Middle strong change under turn.
3042,Especialidad_3042,Report current until join teach design.
3043,Especialidad_3043,Source low key marriage north join.
3044,Especialidad_3044,Certain environment president result.
3045,Especialidad_3045,Us thank often we.
3046,Especialidad_3046,Card ahead impact task sure group.
3047,Especialidad_3047,Administration sign war take north.
3048,Especialidad_3048,System series field hour.
3049,Especialidad_3049,Hotel law meeting computer major.
3050,Especialidad_3050,Six option choice seat push though amount.
3051,Especialidad_3051,West give become.
3052,Especialidad_3052,Technology market buy development heavy music mother.
3053,Especialidad_3053,Even happy message go technology edge hot she.
3054,Especialidad_3054,Put trial vote mean result board live.
3055,Especialidad_3055,Take course study authority.
3056,Especialidad_3056,Company and keep to toward dream instead.
3057,Especialidad_3057,Onto glass tend when price station another.
3058,Especialidad_3058,Live fire southern give.
3059,Especialidad_3059,Movement long look one before send whole forget.
3060,Especialidad_3060,Per reveal manager reason kitchen great fast top.
3061,Especialidad_3061,Key certainly far dog.
3062,Especialidad_3062,Take need next true direction.
3063,Especialidad_3063,Television recently success at worker.
3064,Especialidad_3064,Light increase meeting.
