id_especialidad,nombre,descripcion
7391,Especialidad_7391,Less politics week unit serve marriage white.
7392,Especialidad_7392,System bad report paper hear.
7393,Especialidad_7393,Raise spend each.
7394,Especialidad_7394,Place ask similar item each.
7395,Especialidad_7395,Difficult difference break ball fast main surface conference.
7396,Especialidad_7396,Bed yard try structure impact price mean.
7397,Especialidad_7397,Young teacher laugh help purpose Mrs hour.
7398,Especialidad_7398,Side room west situation door.
7399,Especialidad_7399,Recently offer others scientist become quite.
7400,Especialidad_7400,Another expect organization any present room.
7401,Especialidad_7401,Better person movie.
7402,Especialidad_7402,Land defense wear actually always affect scene.
7403,Especialidad_7403,Position summer data fire.
7404,Especialidad_7404,Yes indeed when.
7405,Especialidad_7405,Shake voice price lot mission nation phone.
7406,Especialidad_7406,Machine store TV turn over.
7407,Especialidad_7407,Response television wish often exist travel.
7408,Especialidad_7408,These compare upon scene fact or clearly short.
7409,Especialidad_7409,Group our expect sort.
7410,Especialidad_7410,Or whose development fly include particularly.
7411,Especialidad_7411,Blood rather economic over big.
7412,Especialidad_7412,President scene boy step choose themselves.
7413,Especialidad_7413,Speech form seek level participant.
7414,Especialidad_7414,Level figure bank every perform measure.
7415,Especialidad_7415,Individual direction kid be.
7416,Especialidad_7416,Peace lawyer same ago moment company.
7417,Especialidad_7417,Pass region human.
7418,Especialidad_7418,Later child address toward ever kind might.
7419,Especialidad_7419,Each whose perform.
7420,Especialidad_7420,Collection impact save career culture energy.
7421,Especialidad_7421,Those gun ground each.
7422,Especialidad_7422,Turn one key range system.
7423,Especialidad_7423,Condition research war community kitchen another spend.
7424,Especialidad_7424,Name think woman network sister really century.
7425,Especialidad_7425,Defense matter carry possible knowledge hour color.
7426,Especialidad_7426,Democratic shake now along social wind.
7427,Especialidad_7427,Who suffer read total front.
7428,Especialidad_7428,Begin any rate receive eight.
7429,Especialidad_7429,Treatment strong or door receive indicate.
7430,Especialidad_7430,Develop wife develop above create new guess professional.
7431,Especialidad_7431,Admit much a.
7432,Especialidad_7432,Specific catch performance nation.
7433,Especialidad_7433,Of suffer fight daughter even before camera.
7434,Especialidad_7434,Project media rate.
7435,Especialidad_7435,Music class trip.
7436,Especialidad_7436,Break world student office wonder small.
7437,Especialidad_7437,Time look cost like blood various.
7438,Especialidad_7438,Close especially method all drop.
7439,Especialidad_7439,Likely Democrat huge woman page.
7440,Especialidad_7440,Company great husband commercial despite free give.
7441,Especialidad_7441,Sure campaign simply.
7442,Especialidad_7442,Pass can education pattern impact store.
7443,Especialidad_7443,Price piece dark good draw.
7444,Especialidad_7444,Lead watch lawyer front.
7445,Especialidad_7445,Marriage stock answer create take agent imagine.
7446,Especialidad_7446,From attention she themselves.
7447,Especialidad_7447,Defense imagine tend become quickly.
7448,Especialidad_7448,Fall American manager hour worker herself red.
7449,Especialidad_7449,Make letter investment house.
7450,Especialidad_7450,Herself front line.
7451,Especialidad_7451,Want investment throw must image skin still.
7452,Especialidad_7452,Purpose dark always machine material number test.
7453,Especialidad_7453,Amount since south why can artist.
7454,Especialidad_7454,Night add early agree travel.
7455,Especialidad_7455,Available difficult old there.
7456,Especialidad_7456,Relationship by design thing fear crime strong beyond.
7457,Especialidad_7457,Also commercial reveal floor.
7458,Especialidad_7458,Child center question treat point.
7459,Especialidad_7459,Home action short southern.
7460,Especialidad_7460,View score cost themselves.
7461,Especialidad_7461,Event against provide modern.
7462,Especialidad_7462,Church item yard need middle.
7463,Especialidad_7463,National middle save run day course.
7464,Especialidad_7464,Success heart have and.
7465,Especialidad_7465,Conference low early east employee than.
7466,Especialidad_7466,Himself everyone involve involve can young fine fund.
7467,Especialidad_7467,Defense go miss.
7468,Especialidad_7468,Billion over worker own beautiful bit.
7469,Especialidad_7469,On job program idea happy.
7470,Especialidad_7470,Stock difficult deep stuff dinner.
7471,Especialidad_7471,There as especially.
7472,Especialidad_7472,Main chair rock economy.
7473,Especialidad_7473,Threat factor cultural series.
7474,Especialidad_7474,If how according argue enter assume.
7475,Especialidad_7475,Condition six use mean mean catch loss.
7476,Especialidad_7476,Reveal around rock turn material house media pull.
7477,Especialidad_7477,Fact night leg forget between administration little investment.
7478,Especialidad_7478,Our clearly present assume end order fight.
7479,Especialidad_7479,Avoid significant treatment deal leader effort.
7480,Especialidad_7480,Parent space difference represent.
7481,Especialidad_7481,Chance popular possible.
7482,Especialidad_7482,Meeting on nature edge.
7483,Especialidad_7483,A current organization range live.
7484,Especialidad_7484,Present gun activity eye reduce which.
7485,Especialidad_7485,Listen side story pass.
7486,Especialidad_7486,Decide cell state popular may could local.
7487,Especialidad_7487,Social perhaps shake easy.
7488,Especialidad_7488,Those present theory.
7489,Especialidad_7489,Writer outside claim mind also meeting.
7490,Especialidad_7490,War team everybody police scene very task.
7491,Especialidad_7491,Group thousand worry boy do.
7492,Especialidad_7492,Put successful growth Democrat me when.
7493,Especialidad_7493,Former thing something mouth wide behind west.
7494,Especialidad_7494,Prepare everybody thing leader to produce treat.
7495,Especialidad_7495,Administration try space civil herself able.
7496,Especialidad_7496,Relationship capital pattern defense campaign range.
7497,Especialidad_7497,Political talk list take understand open military.
7498,Especialidad_7498,It western likely house character sport ever or.
7499,Especialidad_7499,Against language join player.
7500,Especialidad_7500,Response floor boy.
7501,Especialidad_7501,South son guy me away soldier such.
7502,Especialidad_7502,Brother range family me oil difficult.
7503,Especialidad_7503,Nation south later.
7504,Especialidad_7504,Remain sit simply though similar certain medical force.
7505,Especialidad_7505,We citizen support everybody step benefit ahead.
7506,Especialidad_7506,Culture may movement form all.
7507,Especialidad_7507,Gun keep music.
7508,Especialidad_7508,Seek someone account type.
7509,Especialidad_7509,Arrive anything kitchen.
7510,Especialidad_7510,Wonder high themselves visit suffer term training.
7511,Especialidad_7511,Only become Democrat live.
7512,Especialidad_7512,Business guess by morning nation former.
7513,Especialidad_7513,Start discuss much gun run cup.
7514,Especialidad_7514,Color article American knowledge source.
7515,Especialidad_7515,Skin beat lot defense option.
7516,Especialidad_7516,Current school owner road.
7517,Especialidad_7517,Early eye growth good inside.
7518,Especialidad_7518,Door never keep southern everybody strategy.
7519,Especialidad_7519,Newspaper laugh sound similar.
7520,Especialidad_7520,Inside young resource per finally many investment.
7521,Especialidad_7521,Far win these product far reason kitchen.
7522,Especialidad_7522,Time cell relationship black smile threat.
7523,Especialidad_7523,Book campaign material bank join.
7524,Especialidad_7524,Final tend team agreement girl.
7525,Especialidad_7525,Final democratic fast attack indeed news.
7526,Especialidad_7526,Outside office huge animal usually college notice term.
7527,Especialidad_7527,Political market only cover raise from.
7528,Especialidad_7528,Million age catch call nature particular direction.
7529,Especialidad_7529,Seat really hand receive no million around.
7530,Especialidad_7530,Concern sense guess sea hard society.
7531,Especialidad_7531,Resource specific camera.
7532,Especialidad_7532,Happen you fill standard inside.
7533,Especialidad_7533,Manager kid among off listen.
7534,Especialidad_7534,Town far including save enter life.
7535,Especialidad_7535,Weight whole international top sell today social.
7536,Especialidad_7536,Bill effort song behavior skill budget smile.
7537,Especialidad_7537,Impact feeling white.
7538,Especialidad_7538,Visit able city door top question.
7539,Especialidad_7539,Drive I field pass war letter us.
7540,Especialidad_7540,Tough later other tend.
7541,Especialidad_7541,Natural party expect make.
7542,Especialidad_7542,Man health say point phone the available.
7543,Especialidad_7543,Growth once reason trade world national deal machine.
7544,Especialidad_7544,Soldier agree laugh accept.
7545,Especialidad_7545,Thousand record sometimes more production training success.
7546,Especialidad_7546,Rest guy east everybody political.
7547,Especialidad_7547,Box fear establish walk.
7548,Especialidad_7548,Around whole indicate cold.
7549,Especialidad_7549,Last hand set beat energy.
7550,Especialidad_7550,Campaign key act.
7551,Especialidad_7551,Majority sport past.
7552,Especialidad_7552,Near short here.
7553,Especialidad_7553,Daughter west wait.
7554,Especialidad_7554,Ball break political recent direction practice.
7555,Especialidad_7555,Indicate eight argue region have simply.
7556,Especialidad_7556,Speech conference out should watch democratic.
7557,Especialidad_7557,Series court note social citizen live.
7558,Especialidad_7558,Since each police be finish.
7559,Especialidad_7559,Beyond read himself phone down what.
7560,Especialidad_7560,Not significant himself possible line bag.
7561,Especialidad_7561,Education high him others.
7562,Especialidad_7562,Former administration very.
7563,Especialidad_7563,Color for game.
7564,Especialidad_7564,Draw behavior specific assume thousand character.
7565,Especialidad_7565,Law bill worry sister himself war tend theory.
7566,Especialidad_7566,Cell trip perhaps bring.
7567,Especialidad_7567,Picture explain commercial hand seat.
7568,Especialidad_7568,Bill network water say million.
7569,Especialidad_7569,New worry think deep.
7570,Especialidad_7570,You true own police most speech.
7571,Especialidad_7571,Late meeting create direction among.
7572,Especialidad_7572,Reason school capital his interview subject.
7573,Especialidad_7573,Nearly agency cell whether military.
7574,Especialidad_7574,Door new certain from.
7575,Especialidad_7575,Significant others one government price project.
7576,Especialidad_7576,Rich later garden laugh.
7577,Especialidad_7577,Around feel address south loss surface most firm.
7578,Especialidad_7578,Amount whose while process if up despite to.
7579,Especialidad_7579,Else figure somebody force.
7580,Especialidad_7580,Available easy suggest news story.
7581,Especialidad_7581,Investment rather risk week.
7582,Especialidad_7582,Adult nice system find test official voice.
7583,Especialidad_7583,Sport firm past throughout nothing guess.
7584,Especialidad_7584,Medical least partner seven.
7585,Especialidad_7585,Star public girl world method start myself.
7586,Especialidad_7586,Hospital part second tend month.
7587,Especialidad_7587,Respond building early night.
7588,Especialidad_7588,Attorney player against coach art.
7589,Especialidad_7589,Hard way admit difficult church become.
7590,Especialidad_7590,Quickly impact dinner owner pretty good whatever.
7591,Especialidad_7591,Energy money form employee choice similar long.
7592,Especialidad_7592,Surface sound society staff player.
7593,Especialidad_7593,Trouble option strong all tax open.
7594,Especialidad_7594,Necessary or place others maintain produce trouble think.
7595,Especialidad_7595,My simple point.
7596,Especialidad_7596,A soon thought want.
7597,Especialidad_7597,Physical lawyer help very religious throw particular.
7598,Especialidad_7598,Over vote carry dream push question.
7599,Especialidad_7599,Represent simply magazine relationship continue such.
7600,Especialidad_7600,Choice chair onto case win factor.
7601,Especialidad_7601,Partner race if special but political arm thus.
7602,Especialidad_7602,Chance senior imagine early possible.
7603,Especialidad_7603,Stay contain consumer cup he game whatever.
7604,Especialidad_7604,Maintain affect others large dinner plan maintain fire.
7605,Especialidad_7605,Education gun recognize.
7606,Especialidad_7606,Alone however trouble last.
7607,Especialidad_7607,War site then sit age.
7608,Especialidad_7608,Require chance share garden thousand there.
7609,Especialidad_7609,Wife station organization particularly data product.
7610,Especialidad_7610,Western message feeling southern level sea special.
7611,Especialidad_7611,Focus my protect.
7612,Especialidad_7612,Pressure yeah character treatment from because.
7613,Especialidad_7613,Knowledge finally over power ok state father.
7614,Especialidad_7614,Try serious less recent you push actually.
7615,Especialidad_7615,Clearly marriage apply long market go mother.
7616,Especialidad_7616,Main garden hot increase discover involve.
7617,Especialidad_7617,Friend key wish participant record check week and.
7618,Especialidad_7618,Environmental institution happen campaign.
7619,Especialidad_7619,Land throw effect today around data.
7620,Especialidad_7620,Position design alone chair.
7621,Especialidad_7621,As owner back whose defense allow win plant.
7622,Especialidad_7622,Debate experience turn guy.
7623,Especialidad_7623,Probably beyond available although night scientist difficult.
7624,Especialidad_7624,Door simply ok fight various paper character.
7625,Especialidad_7625,Reach describe thing foot network.
7626,Especialidad_7626,Scientist change usually choice.
7627,Especialidad_7627,Nearly month tend officer game yard.
7628,Especialidad_7628,Culture alone writer attack.
7629,Especialidad_7629,Wear new young see guess apply.
7630,Especialidad_7630,Official bank entire have memory decade.
7631,Especialidad_7631,Establish child share third recent drug enter.
7632,Especialidad_7632,Letter student push religious check.
7633,Especialidad_7633,Election many oil few everybody.
7634,Especialidad_7634,Not there shake research.
7635,Especialidad_7635,Common star wall car he community.
7636,Especialidad_7636,Third service once sometimes.
7637,Especialidad_7637,Notice Republican return about rich act seat learn.
7638,Especialidad_7638,She later scene participant walk never player.
7639,Especialidad_7639,Ball situation move respond might ever not.
7640,Especialidad_7640,Now fear talk life young.
7641,Especialidad_7641,Better language sometimes recent start scene.
7642,Especialidad_7642,Forget each voice identify culture others.
7643,Especialidad_7643,At under series off education long mind.
7644,Especialidad_7644,Stop our few hot whole base.
7645,Especialidad_7645,Modern become require.
7646,Especialidad_7646,Detail own join pay.
7647,Especialidad_7647,Success true south cultural can doctor nor.
7648,Especialidad_7648,High reach be operation.
7649,Especialidad_7649,Work truth professional.
7650,Especialidad_7650,Others or charge away.
7651,Especialidad_7651,Forget major care.
7652,Especialidad_7652,Lead religious serve buy.
7653,Especialidad_7653,Enough expect most.
7654,Especialidad_7654,Hour common attack parent million.
7655,Especialidad_7655,Employee year door more natural interest.
7656,Especialidad_7656,More career maybe.
7657,Especialidad_7657,Side executive see themselves run consider professional thus.
7658,Especialidad_7658,Some response half movie enough something.
7659,Especialidad_7659,Mean score yard wear great.
7660,Especialidad_7660,Public cell certainly administration.
7661,Especialidad_7661,Interest result sort long have military day.
7662,Especialidad_7662,No leader as offer clearly box.
7663,Especialidad_7663,Support interest his everybody budget case worry.
7664,Especialidad_7664,Chair successful manager friend.
7665,Especialidad_7665,Grow down professional.
7666,Especialidad_7666,Happy approach between treatment wind another crime.
7667,Especialidad_7667,Cultural lay assume weight consider trip professor.
7668,Especialidad_7668,Civil institution improve sport.
7669,Especialidad_7669,Scene from bit situation.
7670,Especialidad_7670,Black high phone generation including city because.
7671,Especialidad_7671,Job light seem itself.
7672,Especialidad_7672,Human responsibility catch report look important degree late.
7673,Especialidad_7673,Factor enjoy relationship building.
7674,Especialidad_7674,Candidate whole feel.
7675,Especialidad_7675,Career campaign long push style inside shoulder.
7676,Especialidad_7676,Successful cost answer blood.
7677,Especialidad_7677,Everyone capital machine Mr organization can community.
7678,Especialidad_7678,Eat budget difference.
7679,Especialidad_7679,Exactly idea rock if.
7680,Especialidad_7680,Direction window push against on red tree skill.
7681,Especialidad_7681,Owner sea these whatever somebody.
7682,Especialidad_7682,Seat family soon.
7683,Especialidad_7683,Traditional always nearly listen plan.
7684,Especialidad_7684,Team age you trial hold feeling yourself she.
7685,Especialidad_7685,Yet wait individual scene read growth perform.
7686,Especialidad_7686,Game instead thus throw.
7687,Especialidad_7687,Network institution performance reduce more pattern.
7688,Especialidad_7688,Chance central data sister sound home trip.
7689,Especialidad_7689,Miss foreign evening certain.
7690,Especialidad_7690,Hold she act many goal.
7691,Especialidad_7691,Use here again accept admit result floor.
7692,Especialidad_7692,Movie others method mention foot along month.
7693,Especialidad_7693,Agent feel with plan.
7694,Especialidad_7694,Magazine color likely spend particularly relationship serious.
7695,Especialidad_7695,Hotel shoulder reality trip create capital six.
7696,Especialidad_7696,Effort maintain boy voice doctor unit sing along.
7697,Especialidad_7697,Threat body you know together body very.
7698,Especialidad_7698,Still baby health world office quickly body pattern.
7699,Especialidad_7699,Ok ahead hit look school.
7700,Especialidad_7700,Authority she front thing finish gas.
7701,Especialidad_7701,Past piece myself able left begin buy.
7702,Especialidad_7702,In office win become interesting soldier.
7703,Especialidad_7703,Should actually million whom oil open there.
7704,Especialidad_7704,Community simply interest sell project couple sport.
7705,Especialidad_7705,Trouble modern within make leave draw common.
7706,Especialidad_7706,Behind if song plant actually sing.
7707,Especialidad_7707,Certainly forward reflect.
7708,Especialidad_7708,Cover property industry whether.
7709,Especialidad_7709,Reach play describe because side.
7710,Especialidad_7710,Happy family trip anyone say.
7711,Especialidad_7711,Project question thousand idea pass.
7712,Especialidad_7712,Give I own federal.
7713,Especialidad_7713,Rock safe behavior thank live.
7714,Especialidad_7714,Can career of color recent.
7715,Especialidad_7715,Say interesting your any page.
7716,Especialidad_7716,Boy federal win understand nice.
7717,Especialidad_7717,Happen box nature forget start stage.
7718,Especialidad_7718,Resource data recent across nation specific allow no.
7719,Especialidad_7719,Since system start small him.
7720,Especialidad_7720,Never then station get old nice go.
7721,Especialidad_7721,Production treatment current describe card region.
7722,Especialidad_7722,Politics station administration south left former.
7723,Especialidad_7723,Now where huge between power food idea relate.
7724,Especialidad_7724,Recently agent from reason herself story surface.
7725,Especialidad_7725,Concern style bag Mr them sea born.
7726,Especialidad_7726,Color administration stage carry use expect region environmental.
7727,Especialidad_7727,Cover evening doctor chair interview style organization so.
7728,Especialidad_7728,Some card wide star career factor phone.
7729,Especialidad_7729,Team group watch maintain expect important itself.
7730,Especialidad_7730,Economic edge staff president civil.
7731,Especialidad_7731,Explain ahead edge white.
7732,Especialidad_7732,Especially door other situation whole.
7733,Especialidad_7733,Tv investment security short model begin.
7734,Especialidad_7734,Issue consumer ever despite.
7735,Especialidad_7735,Decade song provide total tough truth new.
7736,Especialidad_7736,Security for risk parent public hospital.
7737,Especialidad_7737,Live get own institution able change.
7738,Especialidad_7738,Technology knowledge official knowledge.
7739,Especialidad_7739,Street some religious woman thought.
7740,Especialidad_7740,Popular one themselves over.
7741,Especialidad_7741,Approach become born walk condition identify quality little.
7742,Especialidad_7742,Save call modern.
7743,Especialidad_7743,Evening rest for bar long example.
7744,Especialidad_7744,Whatever nation bad support chance every everybody same.
7745,Especialidad_7745,National man decision that instead note want.
7746,Especialidad_7746,Teach we medical pick.
7747,Especialidad_7747,Now truth discover person federal down rise.
7748,Especialidad_7748,Reason within continue yet kind.
7749,Especialidad_7749,Husband risk a national culture hold growth.
7750,Especialidad_7750,Hot four chair.
7751,Especialidad_7751,Walk action short detail rather somebody top.
7752,Especialidad_7752,Indeed worry four hit ago by read.
7753,Especialidad_7753,Answer couple night significant.
7754,Especialidad_7754,Real kitchen join race bar dinner.
7755,Especialidad_7755,Half public care national.
7756,Especialidad_7756,Sell list never particularly.
7757,Especialidad_7757,Amount green yeah pressure character develop.
7758,Especialidad_7758,Truth side particular meet city writer.
7759,Especialidad_7759,Mrs mother growth indicate high.
7760,Especialidad_7760,Nice unit in career could.
7761,Especialidad_7761,Matter more laugh board cost near four.
7762,Especialidad_7762,War performance population often north type until institution.
7763,Especialidad_7763,Line along parent bed difficult could tough continue.
7764,Especialidad_7764,Stage sign positive her science staff home leave.
7765,Especialidad_7765,Third figure nothing live class.
7766,Especialidad_7766,View operation official decade just.
7767,Especialidad_7767,Recognize explain price soldier such.
7768,Especialidad_7768,Try she defense dinner win raise.
7769,Especialidad_7769,Letter feel trial Mr really use think.
7770,Especialidad_7770,Today toward dinner approach speak because.
7771,Especialidad_7771,Mission whose baby she.
7772,Especialidad_7772,Your drug rock whatever nature vote speech.
7773,Especialidad_7773,Animal him sort animal.
7774,Especialidad_7774,Other such make education Mrs really opportunity.
7775,Especialidad_7775,Serve in several nor woman.
7776,Especialidad_7776,Magazine investment other relationship foot another account arrive.
7777,Especialidad_7777,After color bag activity start.
7778,Especialidad_7778,Star key own want level whatever thousand like.
7779,Especialidad_7779,Would song service.
7780,Especialidad_7780,Away whether attack knowledge per.
7781,Especialidad_7781,A article main add gun.
7782,Especialidad_7782,Team send gas accept among represent wall ago.
7783,Especialidad_7783,Around million long want.
7784,Especialidad_7784,Still five hear argue fear memory.
7785,Especialidad_7785,Training entire tend event.
7786,Especialidad_7786,Leader member material usually hair.
7787,Especialidad_7787,Future better month central especially think.
7788,Especialidad_7788,Agree staff mention three everything reveal social eight.
7789,Especialidad_7789,Where own bar point nice here best.
7790,Especialidad_7790,Edge lawyer dream perform.
7791,Especialidad_7791,Door big although red save event.
7792,Especialidad_7792,President reflect generation spring by then.
7793,Especialidad_7793,Behavior remain husband.
7794,Especialidad_7794,Audience pretty yeah wide as debate.
7795,Especialidad_7795,Ever little never imagine arm effect.
7796,Especialidad_7796,How add know town enough foreign.
7797,Especialidad_7797,Allow up west to unit theory face must.
7798,Especialidad_7798,Important painting speech out bring.
7799,Especialidad_7799,Culture support win scientist.
7800,Especialidad_7800,Cause interview language side company seat no.
7801,Especialidad_7801,From very involve adult.
7802,Especialidad_7802,White at hear series fill picture part to.
7803,Especialidad_7803,Require dog smile.
7804,Especialidad_7804,Trip system scene protect generation.
7805,Especialidad_7805,Stop identify her kind time.
7806,Especialidad_7806,Growth finish serious camera expect likely only game.
7807,Especialidad_7807,Can sense program man fly someone social.
7808,Especialidad_7808,Maintain toward five test size nor.
7809,Especialidad_7809,Early save friend action open school fire.
7810,Especialidad_7810,Spring later stock continue fact.
7811,Especialidad_7811,Its reflect new style generation identify.
7812,Especialidad_7812,Share cover learn event interest never.
7813,Especialidad_7813,Style state benefit country better.
7814,Especialidad_7814,Lawyer book white analysis rise near history.
7815,Especialidad_7815,Remain building heavy century.
7816,Especialidad_7816,Back hard new thing another share brother.
7817,Especialidad_7817,Economic feeling present short standard.
7818,Especialidad_7818,Would rather career leave minute available forward Congress.
7819,Especialidad_7819,Room them share manage southern.
7820,Especialidad_7820,Door five example able why staff social early.
